year,paper,citations
2018,Embodied Question Answering,360
2018,Learning by Asking Questions,54
2018,Finding Tiny Faces in the Wild With Generative Adversarial Network,130
2018,Learning Pose Specific Representations by Predicting Different Views,21
2018,Weakly and Semi Supervised Human Body Part Parsing via Pose-Guided Knowledge Transfer,75
2018,Person Transfer GAN to Bridge Domain Gap for Person Re-Identification,822
2018,Cross-Modal Deep Variational Hand Pose Estimation,183
2018,Disentangled Person Image Generation,332
2018,Super-FAN: Integrated Facial Landmark Localization and Super-Resolution of Real-World Low Resolution Faces in Arbitrary Poses With GANs,193
2018,Multistage Adversarial Losses for Pose-Based Human Image Synthesis,51
2018,Hybrid Camera Pose Estimation,37
2018,A Certifiably Globally Optimal Solution to the Non-Minimal Relative Pose Problem,32
2018,Fight Ill-Posedness With Ill-Posedness: Single-Shot Variational Depth Super-Resolution From Shading,33
2018,Deep Depth Completion of a Single RGB-D Image,212
2018,PPFNet: Global Context Aware Local Features for Robust 3D Point Matching,217
2018,FoldingNet: Point Cloud Auto-Encoder via Deep Grid Deformation,514
2018,A Papier-Mâché Approach to Learning 3D Surface Generation,599
2018,LEGO: Learning Edge With Geometry All at Once by Watching Videos,115
2018,Five-Point Fundamental Matrix Estimation for Uncalibrated Cameras,25
2018,PointFusion: Deep Sensor Fusion for 3D Bounding Box Estimation,306
2018,Scalable Dense Non-Rigid Structure-From-Motion: A Grassmannian Perspective,39
2018,GVCNN: Group-View Convolutional Neural Networks for 3D Shape Recognition,244
2018,Depth and Transient Imaging With Compressive SPAD Array Cameras,10
2018,GeoNet: Geometric Neural Network for Joint Depth and Surface Normal Estimation,198
2018,Real-Time Seamless Single Shot 6D Object Pose Prediction,458
2018,"Factoring Shape, Pose, and Layout From the 2D Image of a 3D Scene",82
2018,Spline Error Weighting for Robust Visual-Inertial Fusion,15
2018,Single-Image Depth Estimation Based on Fourier Domain Analysis,76
2018,Unsupervised Learning of Monocular Depth Estimation and Visual Odometry With Deep Feature Reconstruction,396
2018,Detect-and-Track: Efficient Pose Estimation in Videos,166
2018,Supervision-by-Registration: An Unsupervised Approach to Improve the Precision of Facial Landmark Detectors,149
2018,Style Aggregated Network for Facial Landmark Detection,218
2018,Learning Deep Models for Face Anti-Spoofing: Binary or Auxiliary Supervision,297
2018,First-Person Hand Action Benchmark With RGB-D Videos and 3D Hand Pose Annotations,231
2018,A Pose-Sensitive Embedding for Person Re-Identification With Expanded Cross Neighborhood Re-Ranking,346
2018,Learning to Estimate 3D Human Pose and Shape From a Single Color Image,327
2018,Glimpse Clouds: Human Activity Recognition From Unstructured Feature Points,87
2018,Context-Aware Deep Feature Compression for High-Speed Visual Tracking,169
2018,The Best of Both Worlds: Combining CNNs and Geometric Constraints for Hierarchical Motion Segmentation,32
2018,Hyperparameter Optimization for Tracking With Continuous Deep Q-Learning,121
2018,A Prior-Less Method for Multi-Face Tracking in Unconstrained Videos,20
2018,Learning Superpixels With Segmentation-Aware Affinity Loss,65
2018,Interactive Image Segmentation With Latent Diversity,86
2018,Recovering Realistic Texture in Image Super-Resolution by Deep Spatial Feature Transform,395
2018,Deep Extreme Cut: From Extreme Points to Object Segmentation,234
2018,Occlusion-Aware Rolling Shutter Rectification of 3D Scenes,17
2018,Intrinsic Image Transformation via Scale Space Decomposition,15
2018,Learned Shape-Tailored Descriptors for Segmentation,7
2018,Joint Cuts and Matching of Partitions in One Graph,16
2018,Hallucinated-IQA: No-Reference Image Quality Assessment via Adversarial Learning,104
2018,NAG: Network for Adversary Generation,88
2018,Cross-Domain Self-Supervised Multi-Task Feature Learning Using Synthetic Imagery,144
2018,Robust Facial Landmark Detection via a Fully-Convolutional Local-Global Context Network,73
2018,Learning to Sketch With Shortcut Cycle Consistency,59
2018,FaceID-GAN: Learning a Symmetry Three-Player GAN for Identity-Preserving Face Synthesis,103
2018,Modulated Convolutional Networks,26
2018,Learning Steerable Filters for Rotation Equivariant CNNs,201
2018,Efficient Interactive Annotation of Segmentation Datasets With Polygon-RNN++,237
2018,SplineCNN: Fast Geometric Deep Learning With Continuous B-Spline Kernels,234
2018,GAGAN: Geometry-Aware Generative Adversarial Networks,39
2018,On the Robustness of Semantic Segmentation Models to Adversarial Attacks,169
2018,Feedback-Prop: Convolutional Neural Network Inference Under Partial Evidence,8
2018,Frustum PointNets for 3D Object Detection From RGB-D Data,1232
2018,3D Object Detection With Latent Support Surfaces,19
2018,Towards Faster Training of Global Covariance Pooling Networks by Iterative Matrix Square Root Normalization,149
2018,Improving Occlusion and Hard Negative Handling for Single-Stage Pedestrian Detectors,55
2018,Learning to Act Properly: Predicting and Explaining Affordances From Images,35
2018,Pointwise Convolutional Neural Networks,291
2018,Image-Image Domain Adaptation With Preserved Self-Similarity and Domain-Dissimilarity for Person Re-Identification,593
2018,A Generative Adversarial Approach for Zero-Shot Learning From Noisy Texts,275
2018,Hierarchical Novelty Detection for Visual Object Recognition,40
2018,Human Semantic Parsing for Person Re-Identification,386
2018,Stacked Latent Attention for Multimodal Reasoning,26
2018,CSRNet: Dilated Convolutional Neural Networks for Understanding the Highly Congested Scenes,661
2018,On the Convergence of PatchMatch and Its Variants,4
2018,Rethinking the Faster R-CNN Architecture for Temporal Action Localization,362
2018,MoNet: Deep Motion Exploitation for Video Object Segmentation,69
2018,Recognizing Human Actions as the Evolution of Pose Estimation Maps,157
2018,Video Person Re-Identification With Competitive Snippet-Similarity Aggregation and Co-Attentive Snippet Embedding,132
2018,Blazingly Fast Video Object Segmentation With Pixel-Wise Metric Learning,168
2018,Learning to Compare: Relation Network for Few-Shot Learning,1791
2018,COCO-Stuff: Thing and Stuff Classes in Context,500
2018,Learning to Look Around: Intelligently Exploring Unseen Environments for Unknown Tasks,69
2018,"Multi-Evidence Filtering and Fusion for Multi-Label Classification, Object Detection and Semantic Segmentation Based on Weakly Supervised Learning",145
2018,MAttNet: Modular Attention Network for Referring Expression Comprehension,302
2018,Conditional Generative Adversarial Network for Structured Domain Adaptation,202
2018,GroupCap: Group-Based Image Captioning With Structured Relevance and Diversity Constraints,49
2018,DeepVoting: A Robust and Explainable Deep Network for Semantic Part Detection Under Partial Occlusion,35
2018,Optical Flow Guided Feature: A Fast and Robust Motion Representation for Video Action Recognition,193
2018,Excitation Backprop for RNNs,32
2018,Structure Preserving Video Prediction,41
2018,On the Importance of Label Quality for Semantic Segmentation,41
2018,Feedback-Prop: Convolutional Neural Network Inference Under Partial Evidence,8
2018,Frustum PointNets for 3D Object Detection From RGB-D Data,1232
2018,Feedback-Prop: Convolutional Neural Network Inference Under Partial Evidence,8
2018,Frustum PointNets for 3D Object Detection From RGB-D Data,1232
2018,Feedback-Prop: Convolutional Neural Network Inference Under Partial Evidence,8
2018,Frustum PointNets for 3D Object Detection From RGB-D Data,1232
2018,3D Object Detection With Latent Support Surfaces,19
2018,Towards Faster Training of Global Covariance Pooling Networks by Iterative Matrix Square Root Normalization,149
2018,Improving Occlusion and Hard Negative Handling for Single-Stage Pedestrian Detectors,55
2018,Learning to Act Properly: Predicting and Explaining Affordances From Images,35
2018,Pointwise Convolutional Neural Networks,291
2018,Image-Image Domain Adaptation With Preserved Self-Similarity and Domain-Dissimilarity for Person Re-Identification,593
2018,A Generative Adversarial Approach for Zero-Shot Learning From Noisy Texts,275
2018,Hierarchical Novelty Detection for Visual Object Recognition,40
2018,Human Semantic Parsing for Person Re-Identification,386
2018,Stacked Latent Attention for Multimodal Reasoning,26
2018,CSRNet: Dilated Convolutional Neural Networks for Understanding the Highly Congested Scenes,661
2018,On the Convergence of PatchMatch and Its Variants,4
2018,Rethinking the Faster R-CNN Architecture for Temporal Action Localization,362
2018,MoNet: Deep Motion Exploitation for Video Object Segmentation,69
2018,Recognizing Human Actions as the Evolution of Pose Estimation Maps,157
2018,Video Person Re-Identification With Competitive Snippet-Similarity Aggregation and Co-Attentive Snippet Embedding,132
2018,Blazingly Fast Video Object Segmentation With Pixel-Wise Metric Learning,168
2018,Learning to Compare: Relation Network for Few-Shot Learning,1791
2018,COCO-Stuff: Thing and Stuff Classes in Context,500
2018,Learning to Look Around: Intelligently Exploring Unseen Environments for Unknown Tasks,69
2018,"Multi-Evidence Filtering and Fusion for Multi-Label Classification, Object Detection and Semantic Segmentation Based on Weakly Supervised Learning",145
2018,MAttNet: Modular Attention Network for Referring Expression Comprehension,302
2018,Conditional Generative Adversarial Network for Structured Domain Adaptation,202
2018,GroupCap: Group-Based Image Captioning With Structured Relevance and Diversity Constraints,49
2018,DeepVoting: A Robust and Explainable Deep Network for Semantic Part Detection Under Partial Occlusion,35
2018,Optical Flow Guided Feature: A Fast and Robust Motion Representation for Video Action Recognition,193
2018,Excitation Backprop for RNNs,32
2018,Structure Preserving Video Prediction,41
2018,On the Importance of Label Quality for Semantic Segmentation,41
2018,Duplex Generative Adversarial Network for Unsupervised Domain Adaptation,118
2018,MoCoGAN: Decomposing Motion and Content for Video Generation,589
2018,Improving Landmark Localization With Semi-Supervised Learning,119
2018,Stochastic Variational Inference With Gradient Linearization,1
2018,Towards Human-Machine Cooperation: Self-Supervised Sample Mining for Object Detection,58
2018,Discrete-Continuous ADMM for Transductive Inference in Higher-Order MRFs,7
2018,Robust Physical-World Attacks on Deep Learning Visual Classification,1503
2018,A High-Quality Denoising Dataset for Smartphone Cameras,200
2018,Enhancing the Spatial Resolution of Stereo Images Using a Parallax Prior,57
2018,HATS: Histograms of Averaged Time Surfaces for Robust Event-Based Object Classification,162
2018,SeedNet: Automatic Seed Generation With Deep Reinforcement Learning for Robust Interactive Segmentation,45
2018,Defense Against Adversarial Attacks Using High-Level Representation Guided Denoiser,425
2018,PieAPP: Perceptual Image-Error Assessment Through Pairwise Preference,89
2018,Normalized Cut Loss for Weakly-Supervised CNN Segmentation,155
2018,Fast End-to-End Trainable Guided Filter,118
2018,Learning a Discriminative Feature Network for Semantic Segmentation,476
2018,pOSE: Pseudo Object Space Error for Initialization-Free Bundle Adjustment,10
2018,Deformable Shape Completion With Graph Convolutional Autoencoders,163
2018,Learning From Millions of 3D Scans for Large-Scale 3D Face Recognition,88
2018,CarFusion: Combining Point Tracking and Part Detection for Dynamic 3D Reconstruction of Vehicles,31
2018,Deep Material-Aware Cross-Spectral Stereo Matching,16
2018,Augmenting Crowd-Sourced 3D Reconstructions Using Semantic Detections,5
2018,Matryoshka Networks: Predicting 3D Geometry via Nested Shape Layers,90
2018,Triplet-Center Loss for Multi-View 3D Object Retrieval,217
2018,Learning 3D Shape Completion From Laser Scan Data With Weak Supervision,109
2018,End-to-End Learning of Keypoint Detector and Descriptor for Pose Invariant 3D Matching,45
2018,Radially-Distorted Conjugate Translations,26
2018,Analytical Modeling of Vanishing Points and Curves in Catadioptric Cameras,7
2018,Salience Guided Depth Calibration for Perceptually Optimized Compressive Light Field 3D Display,11
2018,MegaDepth: Learning Single-View Depth Prediction From Internet Photos,355
2018,LayoutNet: Reconstructing the 3D Room Layout From a Single RGB Image,152
2018,CBMV: A Coalesced Bidirectional Matching Volume for Disparity Estimation,37
2018,Zoom and Learn: Generalizing Deep Stereo Matching to Novel Domains,28
2018,Learning Facial Action Units From Web Images With Scalable Weakly Supervised Clustering,37
2018,Human Pose Estimation With Parsing Induced Learner,76
2018,Monocular 3D Pose and Shape Estimation of Multiple People in Natural Scenes - The Importance of Multiple Scene Constraints,155
2018,"3D Human Sensing, Action and Emotion Recognition in Robot Assisted Therapy of Children With Autism",47
2018,Facial Expression Recognition by De-Expression Residue Learning,225
2018,A Causal And-Or Graph Model for Visibility Fluent Reasoning in Tracking Interacting Objects,21
2018,Unifying Identification and Context Learning for Person Recognition,28
2018,Multiple Granularity Group Interaction Prediction,11
2018,Social GAN: Socially Acceptable Trajectories With Generative Adversarial Networks,843
2018,Deep Group-Shuffling Random Walk for Person Re-Identification,122
2018,Efficient and Deep Person Re-Identification Using Multi-Level Similarity,76
2018,A Perceptual Measure for Deep Single Image Camera Calibration,48
2018,Context Contrasted Feature and Gated Multi-Scale Aggregation for Scene Segmentation,231
2018,Deep Layer Aggregation,607
2018,xUnit: Learning a Spatial Activation Function for Efficient Image Restoration,34
2018,Deformation Aware Image Compression,12
2018,Residual Dense Network for Image Super-Resolution,1616
2018,Attentive Generative Adversarial Network for Raindrop Removal From a Single Image,306
2018,Burst Denoising With Kernel Prediction Networks,190
2018,Surface Networks,59
2018,Self-Supervised Multi-Level Face Model Learning for Monocular Reconstruction at Over 250 Hz,164
2018,"CodeSLAM — Learning a Compact, Optimisable Representation for Dense Visual SLAM",195
2018,SGPN: Similarity Group Proposal Network for 3D Point Cloud Instance Segmentation,286
2018,Deep Parametric Continuous Convolutional Neural Networks,234
2018,FeaStNet: Feature-Steered Graph Convolutions for 3D Shape Analysis,234
2018,Image Collection Pop-Up: 3D Reconstruction and Clustering of Rigid and Non-Rigid Categories,26
2018,Geometry-Aware Learning of Maps for Camera Localization,210
2018,Recurrent Slice Networks for 3D Segmentation of Point Clouds,253
2018,Depth-Based 3D Hand Pose Estimation: From Current Achievements to Future Goals,180
2018,SobolevFusion: 3D Reconstruction of Scenes Undergoing Free Non-Rigid Motion,62
2018,AdaDepth: Unsupervised Content Congruent Adaptation for Depth Estimation,113
2018,Learning to Find Good Correspondences,204
2018,OATM: Occlusion Aware Template Matching by Consensus Set Maximization,14
2018,Deep Learning of Graph Matching,116
2018,Lean Multiclass Crowdsourcing,16
2018,Partial Transfer Learning With Selective Adversarial Networks,234
2018,CondenseNet: An Efficient DenseNet Using Learned Group Convolutions,507
2018,Decoupled Networks,35
2018,Deep Adversarial Metric Learning,152
2018,PU-Net: Point Cloud Upsampling Network,215
2018,Real-Time Monocular Depth Estimation Using Synthetic Data With Domain Adaptation via Image Style Transfer,179
2018,Learning for Disparity Estimation Through Feature Constancy,199
2018,Coding Kendall's Shape Trajectories for 3D Action Recognition,46
2018,"Estimation of Camera Locations in Highly Corrupted Scenarios: All About That Base, No Shape Trouble",7
2018,Reconstructing Thin Structures of Manifold Surfaces by Integrating Spatial Curves,15
2018,Multi-View Consistency as Supervisory Signal for Learning Shape and Pose Prediction,133
2018,Deep Marching Cubes: Learning Explicit Surface Representations,100
2018,Tags2Parts: Discovering Semantic Regions From Shape Tags,19
2018,Robust Depth Estimation From Auto Bracketed Images,6
2018,Camera Pose Estimation With Unknown Principal Point,20
2018,Inverse Composition Discriminative Optimization for Point Cloud Registration,14
2018,"Pixels, Voxels, and Views: A Study of Shape Representations for Single View 3D Object Shape Prediction",70
2018,Defocus Blur Detection via Multi-Stream Bottom-Top-Bottom Fully Convolutional Network,42
2018,Curve Reconstruction via the Global Statistics of Natural Curves,0
2018,What Do Deep Networks Like to See?,25
2018,"Detect Globally, Refine Locally: A Novel Approach to Saliency Detection",264
2018,Beyond the Pixel-Wise Loss for Topology-Aware Delineation,102
2018,KIPPI: KInetic Polygonal Partitioning of Images,14
2018,MoNet: Moments Embedding Network,25
2018,Active Fixation Control to Predict Saccade Sequences,24
2018,Universal Denoising Networks : A Novel CNN Architecture for Image Denoising,191
2018,Deep Video Super-Resolution Network Using Dynamic Upsampling Filters Without Explicit Motion Compensation,260
2018,Erase or Fill? Deep Joint Recurrent Rain Removal and Reconstruction in Videos,108
2018,Flow Guided Recurrent Neural Encoder for Video Salient Object Detection,92
2018,Gated Fusion Network for Single Image Dehazing,365
2018,Learning a Single Convolutional Super-Resolution Network for Multiple Degradations,487
2018,Non-Blind Deblurring: Handling Kernel Uncertainty With CNNs,23
2018,BPGrad: Towards Global Optimality in Deep Learning via Branch and Pruning,21
2018,Domain Adaptive Faster R-CNN for Object Detection in the Wild,516
2018,Adversarially Learned One-Class Classifier for Novelty Detection,356
2018,Disentangling Factors of Variation by Mixing Them,58
2018,Deformable GANs for Pose-Based Human Image Generation,284
2018,Hierarchical Recurrent Attention Networks for Structured Online Maps,29
2018,Sliced Wasserstein Distance for Learning Gaussian Mixture Models,64
2018,CLEAR: Cumulative LEARning for One-Shot One-Class Image Recognition,27
2018,Multi-Task Learning by Maximizing Statistical Dependence,13
2018,"Sparse, Smart Contours to Represent and Edit Images",55
2018,Facelet-Bank for Fast Portrait Manipulation,37
2018,3D-RCNN: Instance-Level 3D Object Reconstruction via Render-and-Compare,196
2018,"Fast and Furious: Real Time End-to-End 3D Detection, Tracking and Motion Forecasting With a Single Convolutional Net",367
2018,Zero-Shot Sketch-Image Hashing,77
2018,VizWiz Grand Challenge: Answering Visual Questions From Blind People,192
2018,Self-Supervised Learning of Geometrically Stable Features Through Probabilistic Introspection,39
2018,Unsupervised Deep Generative Adversarial Hashing Network,68
2018,Wasserstein Introspective Neural Networks,37
2018,Taskonomy: Disentangling Task Transfer Learning,621
2018,Maximum Classifier Discrepancy for Unsupervised Domain Adaptation,803
2018,Unsupervised Feature Learning via Non-Parametric Instance Discrimination,1029
2018,Learning From Synthetic Data: Addressing Domain Shift for Semantic Segmentation,309
2018,Empirical Study of the Topology and Geometry of Deep Networks,121
2018,Weakly Supervised Instance Segmentation Using Class Peak Response,163
2018,Teaching Categories to Human Learners With Visual Explanations,40
2018,Density Adaptive Point Set Registration,31
2018,Left-Right Comparative Recurrent Model for Stereo Matching,53
2018,Modeling Facial Geometry Using Compositional VAEs,49
2018,Tangent Convolutions for Dense Prediction in 3D,253
2018,RayNet: Learning Volumetric 3D Reconstruction With Ray Potentials,46
2018,Neural 3D Mesh Renderer,524
2018,Beyond Grobner Bases: Basis Selection for Minimal Solvers,33
2018,"Lions and Tigers and Bears: Capturing Non-Rigid, 3D, Articulated Shape From Images",57
2018,DOTA: A Large-Scale Dataset for Object Detection in Aerial Images,771
2018,Finding Beans in Burgers: Deep Semantic-Visual Embedding With Localization,73
2018,Feature Super-Resolution: Make Machine See More Clearly,30
2018,ClusterNet: Detecting Small Objects in Large Scenes by Exploiting Spatio-Temporal Information,64
2018,MaskLab: Instance Segmentation by Refining Object Detection With Semantic and Direction Features,256
2018,Who Let the Dogs Out? Modeling Dog Behavior From Visual Data,36
2018,Large Scale Fine-Grained Categorization and Domain-Specific Transfer Learning,272
2018,Data Distillation: Towards Omni-Supervised Learning,280
2018,Object Referring in Videos With Language and Human Gaze,27
2018,A Network Architecture for Point Cloud Classification via Automatic Depth Images Generation,34
2018,Towards Dense Object Tracking in a 2D Honeybee Hive,30
2018,Long-Term On-Board Prediction of People in Traffic Scenes Under Uncertainty,108
2018,Single-Shot Refinement Neural Network for Object Detection,882
2018,Tips and Tricks for Visual Question Answering: Learnings From the 2017 Challenge,292
2018,Learning to Segment Every Thing,229
2018,Parallel Attention: A Unified Framework for Visual Object Discovery Through Dialogs and Queries,59
2018,Attentive Fashion Grammar Network for Fashion Landmark Detection and Clothing Category Classification,161
2018,Partially Shared Multi-Task Convolutional Neural Network With Local Constraint for Face Attribute Learning,60
2018,SYQ: Learning Symmetric Quantization for Efficient Deep Neural Networks,90
2018,DS*: Tighter Lifting-Free Convex Relaxations for Quadratic Matching Problems,26
2018,Coupled End-to-End Transfer Learning With Generalized Fisher Information,18
2018,Residual Parameter Transfer for Deep Domain Adaptation,45
2018,Learning to Localize Sound Source in Visual Scenes,152
2018,Dynamic Few-Shot Visual Learning Without Forgetting,593
2018,Two-Step Quantization for Low-Bit Neural Networks,85
2018,Conditional Probability Models for Deep Image Compression,275
2018,Deep Diffeomorphic Transformer Networks,23
2018,The Lovász-Softmax Loss: A Tractable Surrogate for the Optimization of the Intersection-Over-Union Measure in Neural Networks,305
2018,Generative Adversarial Perturbations,163
2018,PointNetVLAD: Deep Point Cloud Based Retrieval for Large-Scale Place Recognition,176
2018,Im2Struct: Recovering 3D Shape Structure From a Single RGB Image,69
2018,Trust Your Model: Light Field Depth Estimation With Inline Occlusion Handling,39
2018,Baseline Desensitizing in Translation Averaging,13
2018,Mining Point Cloud Local Structures by Kernel Correlation and Graph Pooling,330
2018,Large-Scale Point Cloud Semantic Segmentation With Superpoint Graphs,568
2018,Very Large-Scale Global SfM by Distributed Motion Averaging,63
2018,ScanComplete: Large-Scale Scene Completion and Semantic Segmentation for 3D Scans,171
2018,Solving the Perspective-2-Point Problem for Flying-Camera Photo Composition,0
2018,Reflection Removal for Large-Scale 3D Point Clouds,12
2018,Attentional ShapeContextNet for Point Cloud Recognition,168
2018,Texture Mapping for 3D Reconstruction With RGB-D Sensor,43
2018,Learning Less Is More - 6D Camera Localization via 3D Surface Regression,210
2018,Indoor RGB-D Compass From a Single Line and Plane,6
2018,Geometry-Aware Network for Non-Rigid Shape Prediction From a Single View,39
2018,Sim2Real Viewpoint Invariant Visual Servoing by Recurrent Control,75
2018,Analysis of Hand Segmentation in the Wild,64
2018,RoadTracer: Automatic Extraction of Road Networks From Aerial Images,144
2018,Alternating-Stereo VINS: Observability Analysis and Performance Evaluation,10
2018,Soccer on Your Tabletop,63
2018,EPINET: A Fully-Convolutional Neural Network Using Epipolar Geometry for Depth From Light Field Images,116
2018,A Hybrid l1-l0 Layer Decomposition Model for Tone Mapping,65
2018,Deeply Learned Filter Response Functions for Hyperspectral Reconstruction,45
2018,CRRN: Multi-Scale Guided Concurrent Reflection Removal Network,58
2018,Single Image Reflection Separation With Perceptual Losses,149
2018,A Robust Method for Strong Rolling Shutter Effects Correction Using Lines With Automatic Feature Selection,20
2018,Efficient Diverse Ensemble for Discriminative Co-Tracking,24
2018,Rolling Shutter and Radial Distortion Are Features for High Frame Rate Multi-Camera Tracking,4
2018,A Twofold Siamese Network for Real-Time Object Tracking,388
2018,Multimodal Visual Concept Learning With Weakly Supervised Techniques,6
2018,Efficient Large-Scale Approximate Nearest Neighbor Search on OpenCL FPGA,19
2018,Learning a Complete Image Indexing Pipeline,8
2018,Transparency by Design: Closing the Gap Between Performance and Interpretability in Visual Reasoning,141
2018,Don't Just Assume; Look and Answer: Overcoming Priors for Visual Question Answering,312
2018,Learning Pixel-Level Semantic Affinity With Image-Level Supervision for Weakly Supervised Semantic Segmentation,257
2018,Cross-Domain Weakly-Supervised Object Detection Through Progressive Domain Adaptation,229
2018,RotationNet: Joint Object Categorization and Pose Estimation Using Multiviews From Unsupervised Viewpoints,335
2018,WILDTRACK: A Multi-Camera HD Dataset for Dense Unscripted Pedestrian Detection,59
2018,Natural and Effective Obfuscation by Head Inpainting,105
2018,V2V-PoseNet: Voxel-to-Voxel Prediction Network for Accurate 3D Hand and Human Pose Estimation From a Single Depth Map,265
2018,Ring Loss: Convex Feature Normalization for Face Recognition,165
2018,Adversarially Occluded Samples for Person Re-Identification,156
