year,paper,citations
2018,4DFAB: A Large Scale 4D Database for Facial Expression Analysis and Biometric Applications,73
2018,Seeing Small Faces From Robust Anchor's Perspective,98
2018,2D/3D Pose Estimation and Action Recognition Using Multitask Deep Learning,310
2018,Dense 3D Regression for Hand Pose Estimation,110
2018,PoseTrack: A Benchmark for Human Pose Estimation and Tracking,230
2018,Pose-Robust Face Recognition via Deep Residual Equivariant Mapping,116
2018,Encoding Crowd Interaction With Deep Neural Network for Pedestrian Trajectory Prediction,137
2018,Mean-Variance Loss for Deep Age Estimation From a Face,103
2018,Probabilistic Joint Face-Skull Modelling for Facial Reconstruction,12
2018,Learning Latent Super-Events to Detect Multiple Activities in Videos,60
2018,Temporal Hallucinating for Action Recognition With Few Still Images,16
2018,Deep Progressive Reinforcement Learning for Skeleton-Based Action Recognition,263
2018,When Will You Do What? - Anticipating Temporal Occurrences of Activities,78
2018,Fusing Crowd Density Maps and Visual Object Trackers for People Tracking in Crowd Scenes,18
2018,Dual Attention Matching Network for Context-Aware Feature Sequence Based Person Re-Identification,324
2018,Human Appearance Transfer,75
2018,Domain Generalization With Adversarial Feature Learning,337
2018,Pyramid Stereo Matching Network,699
2018,Learning Answer Embeddings for Visual Question Answering,26
2018,Good View Hunting: Learning Photo Composition From Dense View Pairs,40
2018,CleanNet: Transfer Learning for Scalable Image Classifier Training With Label Noise,213
2018,Structured Uncertainty Prediction Networks,26
2018,Generative Image Inpainting With Contextual Attention,1199
2018,Conditional Image-to-Image Translation,100
2018,Feature Generating Networks for Zero-Shot Learning,509
2018,Joint Optimization Framework for Learning With Noisy Labels,323
2018,Convolutional Image Captioning,238
2018,AON: Towards Arbitrarily-Oriented Text Recognition,193
2018,Wrapped Gaussian Process Regression on Riemannian Manifolds,18
2018,DiverseNet: When One Right Answer Is Not Enough,12
2018,Deep Face Detector Adaptation Without Negative Transfer or Catastrophic Forgetting,12
2018,Regularizing Deep Networks by Modeling and Predicting Label Structure,19
2018,In-Place Activated BatchNorm for Memory-Optimized Training of DNNs,228
2018,DVQA: Understanding Data Visualizations via Question Answering,87
2018,Revisiting Oxford and Paris: Large-Scale Image Retrieval Benchmarking,174
2018,Cross-Dataset Adaptation for Visual Question Answering,26
2018,Globally Optimal Inlier Set Maximization for Atlanta Frame Estimation,15
2018,Referring Image Segmentation via Recurrent Refinement Networks,66
2018,Two Can Play This Game: Visual Dialog With Discriminative Question Generation and Answering,68
2018,A Deeper Look at Power Normalizations,33
2018,Dimensionality's Blessing: Clustering Images by Underlying Distribution,10
2018,Eliminating Background-Bias for Robust Person Re-Identification,105
2018,Learning to Evaluate Image Captioning,78
2018,Single-Shot Object Detection With Enriched Semantics,163
2018,Neural Motifs: Scene Graph Parsing With Global Context,414
2018,Variational Autoencoders for Deforming 3D Mesh Models,113
2018,Fast Monte-Carlo Localization on Aerial Vehicles Using Approximate Continuous Belief Representations,10
2018,Egocentric Basketball Motion Planning From a Single First-Person Image,20
2018,Human-Centric Indoor Scene Synthesis Using Stochastic Grammar,100
2018,Rotation-Sensitive Regression for Oriented Scene Text Detection,271
2018,Separating Self-Expression and Visual Content in Hashtag Supervision,26
2018,Distort-and-Recover: Color Enhancement Using Deep Reinforcement Learning,108
2018,Im2Flow: Motion Hallucination From Static Images for Action Recognition,72
2018,Actor and Action Video Segmentation From a Sentence,63
2018,Egocentric Activity Recognition on a Budget,20
2018,CNN in MRF: Video Object Segmentation via Inference in a CNN-Based Higher-Order Spatio-Temporal MRF,143
2018,End-to-End Learning of Motion Representation for Video Understanding,160
2018,Compressed Video Action Recognition,199
2018,Features for Multi-Target Multi-Camera Tracking and Re-Identification,348
2018,AVA: A Video Dataset of Spatio-Temporally Localized Atomic Visual Actions,501
2018,Who's Better? Who's Best? Pairwise Deep Ranking for Skill Determination,74
2018,MX-LSTM: Mixing Tracklets and Vislets to Jointly Forecast Trajectories and Head Poses,78
2018,FlipDial: A Generative Model for Two-Way Visual Dialogue,31
2018,Unsupervised Textual Grounding: Linking Words to Image Concepts,24
2018,Focal Visual-Text Attention for Visual Question Answering,79
2018,SeGAN: Segmenting and Generating the Invisible,79
2018,Cascade R-CNN: Delving Into High Quality Object Detection,1727
2018,Learning Globally Optimized Object Detector via Policy Gradient,19
2018,Photographic Text-to-Image Synthesis With a Hierarchically-Nested Adversarial Network,209
2018,Trapping Light for Time of Flight,2
2018,The Perception-Distortion Tradeoff,339
2018,Tracking Multiple Objects Outside the Line of Sight Using Speckle Imaging,38
2018,Inferring Light Fields From Shadows,45
2018,Modifying Non-Local Variations Across Multiple Views,9
2018,Deep Photo Enhancer: Unpaired Learning for Image Enhancement From Photographs With GANs,200
2018,LIME: Live Intrinsic Material Estimation,73
2018,Learning to Detect Features in Texture Images,39
2018,Learning to Extract a Video Sequence From a Single Motion-Blurred Image,56
2018,Lose the Views: Limited Angle CT Reconstruction via Implicit Sinogram Completion,47
2018,AMNet: Memorability Estimation With Attention,35
2018,Aperture Supervision for Monocular Depth Estimation,33
2018,Statistical Tomography of Microscopic Life,9
2018,Divide and Conquer for Full-Resolution Light Field Deblurring,9
2018,Improving Color Reproduction Accuracy on Cameras,24
2018,Real-World Anomaly Detection in Surveillance Videos,551
2018,Efficient Video Object Segmentation via Network Modulation,230
2018,Dynamic Video Segmentation Network,62
2018,Motion-Appearance Co-Memory Networks for Video Question Answering,109
2018,Dense Decoder Shortcut Connections for Single-Pass Semantic Segmentation,97
2018,Generative Adversarial Image Synthesis With Decision Tree Latent Controller,19
2018,Learning a Discriminative Prior for Blind Image Deblurring,99
2018,Frame-Recurrent Video Super-Resolution,249
2018,Stereoscopic Neural Style Transfer,74
2018,Latent RANSAC,23
2018,Towards Open-Set Identity Preserving Face Synthesis,150
2018,A Revised Underwater Image Formation Model,86
2018,Graph-Cut RANSAC,109
2018,FFNet: Video Fast-Forwarding via Reinforcement Learning,37
2018,Attend and Interact: Higher-Order Object Interactions for Video Understanding,109
2018,ShuffleNet: An Extremely Efficient Convolutional Neural Network for Mobile Devices,3118
2018,Zero-Shot Recognition via Semantic Embeddings and Knowledge Graphs,347
2018,Referring Relationships,61
2018,Improving Object Localization With Fitness NMS and Bounded IoU Loss,118
2018,End-to-End Deep Kronecker-Product Matching for Person Re-Identification,113
2018,Semantic Visual Localization,184
2018,Objects as Context for Detecting Their Semantic Parts,11
2018,End-to-End Weakly-Supervised Semantic Alignment,122
2018,Dynamic Zoom-In Network for Fast Object Detection in Large Images,88
2018,Deep Reinforcement Learning of Region Proposal Networks for Object Detection,41
2018,Discriminability Objective for Training Descriptive Captions,112
2018,Visual Question Answering With Memory-Augmented Networks,66
2018,Occluded Pedestrian Detection Through Guided Attention in CNNs,251
2018,Reward Learning From Narrated Demonstrations,18
2018,Weakly-Supervised Semantic Segmentation Network With Deep Seeded Region Growing,275
2018,PoTion: Pose MoTion Representation for Action Recognition,178
2018,Dynamic Feature Learning for Partial Face Recognition,35
2018,Deep Spatial Feature Reconstruction for Partial Person Re-Identification: Alignment-Free Approach,153
2018,UV-GAN: Adversarial Facial UV Map Completion for Pose-Invariant Face Recognition,120
2018,End-to-End Recovery of Human Shape and Pose,834
2018,Creating Capsule Wardrobes From Fashion Images,94
2018,"Look, Imagine and Match: Improving Textual-Visual Cross-Modal Retrieval With Generative Models",227
2018,InLoc: Indoor Visual Localization With Dense Matching and View Synthesis,200
2018,Towards High Performance Video Object Detection,149
2018,Neural Baby Talk,298
2018,Few-Shot Image Recognition by Predicting Parameters From Activations,371
2018,Iterative Visual Reasoning Beyond Convolutions,158
2018,Visual Question Reasoning on General Dependency Tree,32
2018,CVM-Net: Cross-View Matching Network for Image-Based Ground-to-Aerial Geo-Localization,85
2018,Revisiting Dilated Convolution: A Simple Approach for Weakly- and Semi-Supervised Semantic Segmentation,305
2018,DensePose: Dense Human Pose Estimation in the Wild,728
2018,Ordinal Depth Supervision for 3D Human Pose Estimation,204
2018,Robust Hough Transform Based 3D Reconstruction From Circular Light Fields,9
2018,Alive Caricature From 2D to 3D,24
2018,Nonlinear 3D Face Morphable Model,196
2018,What Makes a Video a Video: Analyzing Temporal Information in Video Understanding Models and Datasets,70
2018,Fast Video Object Segmentation by Reference-Guided Mask Propagation,225
2018,Actor and Observer: Joint Modeling of First and Third-Person Videos,54
2018,Viewpoint-Aware Video Summarization,30
2018,Photometric Stereo in Participating Media Considering Shape-Dependent Forward Scatter,16
2018,Learning to Adapt Structured Output Space for Semantic Segmentation,667
2018,Multi-Task Learning Using Uncertainty to Weigh Losses for Scene Geometry and Semantics,1260
2018,Jointly Localizing and Describing Events for Dense Video Captioning,108
2018,Going From Image to Video Saliency: Augmenting Image Salience With Dynamic Attentional Push,40
2018,Emotional Attention: A Study of Image Sentiment and Visual Attention,81
2018,"A Low Power, High Throughput, Fully Event-Based Stereo System",38
2018,VITON: An Image-Based Virtual Try-On Network,241
2018,Multi-Oriented Scene Text Detection via Corner Localization and Region Segmentation,234
2018,Multi-Content GAN for Few-Shot Font Style Transfer,190
2018,Audio to Body Dynamics,81
2018,Future Person Localization in First-Person Videos,103
2018,Preserving Semantic Relations for Zero-Shot Learning,161
2018,Show Me a Story: Towards Coherent Neural Story Illustration,21
2018,Fast Spectral Ranking for Similarity Search,41
2018,Mining on Manifolds: Metric Learning Without Labels,76
2018,Differential Attention for Visual Question Answering,54
2018,Toward Driving Scene Understanding: A Dataset for Learning Driver Behavior and Causal Reasoning,124
2018,Learning Attribute Representations With Localization for Flexible Fashion Search,82
2018,Bidirectional Retrieval Made Simple,36
2018,Beyond Trade-Off: Accelerate FCN-Based Face Detector With Higher Accuracy,27
2018,PackNet: Adding Multiple Tasks to a Single Network by Iterative Pruning,336
2018,Neural Sign Language Translation,171
2018,Non-Local Neural Networks,4019
2018,Learning Compressible 360° Video Isomers,13
2018,What Have We Learned From Deep Representations for Action Recognition?,44
2018,Controllable Video Generation With Sparse Trajectories,48
2018,Inference in Higher Order MRF-MAP Problems With Small and Large Cliques,3
2018,ROAD: Reality Oriented Adaptation for Semantic Segmentation of Urban Scenes,201
2018,Eye In-Painting With Exemplar Generative Adversarial Networks,77
2018,Towards Effective Low-Bitwidth Convolutional Neural Networks,148
2018,Stochastic Downsampling for Cost-Adjustable Inference and Improved Regularization in Convolutional Networks,14
2018,Tagging Like Humans: Diverse and Distinct Image Annotation,38
2018,Re-Weighted Adversarial Adaptation Network for Unsupervised Domain Adaptation,91
2018,Regularizing RNNs for Caption Generation by Reconstructing the Past With the Present,69
2018,Unsupervised Domain Adaptation With Similarity Learning,157
2018,Learning Deep Sketch Abstraction,51
2018,Matching Adversarial Networks,17
2018,Learning and Using the Arrow of Time,197
2018,Neural Style Transfer via Meta Networks,70
2018,"People, Penguins and Petri Dishes: Adapting Object Counting Models to New Visual Domains and Object Types Without Forgetting",51
2018,HydraNets: Specialized Dynamic Architectures for Efficient Inference,62
2018,Efficient Parametrization of Multi-Domain Deep Neural Networks,185
2018,Deep Density Clustering of Unconstrained Faces,37
2018,Geometric Multi-Model Fitting With a Convex Relaxation Algorithm,29
2018,Efficient Subpixel Refinement With Symbolic Linear Predictors,1
2018,DeblurGAN: Blind Motion Deblurring Using Conditional Adversarial Networks,766
2018,A2-RL: Aesthetics Aware Reinforcement Learning for Image Cropping,70
2018,On the Duality Between Retinex and Image Dehazing,59
2018,Arbitrary Style Transfer With Deep Feature Reshuffle,85
2018,Missing Slice Recovery for Tensors Using a Low-Rank Model in Embedded Space,42
2018,Deep Semantic Face Deblurring,101
2018,GraphBit: Bitwise Interaction Mining via Deep Reinforcement Learning,25
2018,Recurrent Saliency Transformation Network: Incorporating Multi-Stage Visual Cues for Small Organ Segmentation,131
2018,Visual Feature Attribution Using Wasserstein GANs,80
2018,"Total Capture: A 3D Deformation Model for Tracking Faces, Hands, and Bodies",277
2018,Augmented Skeleton Space Transfer for Depth-Based Hand Pose Estimation,55
2018,Synthesizing Images of Humans in Unseen Poses,208
2018,Detecting and Recognizing Human-Object Interactions,323
2018,Unsupervised Learning and Segmentation of Complex Activities From Video,52
2018,Unsupervised Training for 3D Morphable Model Regression,176
2018,Video Based Reconstruction of 3D People Models,207
2018,Hand PointNet: 3D Hand Pose Estimation Using Point Sets,162
2018,Seeing Voices and Hearing Faces: Cross-Modal Biometric Matching,136
2018,Learning Monocular 3D Human Pose Estimation From Multi-View Images,139
2018,TextureGAN: Controlling Deep Image Synthesis With Texture Patches,190
2018,Connecting Pixels to Privacy and Utility: Automatic Redaction of Private Information in Images,44
2018,MapNet: An Allocentric Spatial Memory for Mapping Environments,91
2018,Accurate and Diverse Sampling of Sequences Based on a “Best of Many” Sample Objective,58
2018,VirtualHome: Simulating Household Activities via Programs,104
2018,Generate to Adapt: Aligning Domains Using Generative Adversarial Networks,417
2018,“Learning-Compression” Algorithms for Neural Net Pruning,114
2018,Guide Me: Interacting With Deep Networks,19
2018,Art of Singular Vectors and Universal Adversarial Perturbations,70
2018,MovieGraphs: Towards Understanding Human-Centric Situations From Videos,66
2018,Benchmarking 6DOF Outdoor Visual Localization in Changing Conditions,295
2018,Unsupervised Person Image Synthesis in Arbitrary Poses,129
2018,Learning Descriptor Networks for 3D Shape Synthesis and Analysis,83
2018,Neural Kinematic Networks for Unsupervised Motion Retargetting,102
2018,Learning Compositional Visual Concepts With Mutual Consistency,11
2018,Iterative Learning With Open-Set Noisy Labels,172
2018,Learning Transferable Architectures for Scalable Image Recognition,3478
2018,SBNet: Sparse Blocks Network for Fast Inference,112
2018,Net2Vec: Quantifying and Explaining How Concepts Are Encoded by Filters in Deep Neural Networks,116
2018,End-to-End Dense Video Captioning With Masked Transformer,235
2018,A Neural Multi-Sequence Alignment TeCHnique (NeuMATCH),12
2018,The INaturalist Species Classification and Detection Dataset,254
2018,StarGAN: Unified Generative Adversarial Networks for Multi-Domain Image-to-Image Translation,2065
2018,High-Resolution Image Synthesis and Semantic Manipulation With Conditional GANs,2120
2018,Semi-Parametric Image Synthesis,99
2018,BlockDrop: Dynamic Inference Paths in Residual Networks,270
2018,Interpretable Convolutional Neural Networks,431
2018,Detach and Adapt: Learning Cross-Domain Disentangled Deep Representation,84
2018,Smooth Neighbors on Teacher Graphs for Semi-Supervised Learning,165
2018,Deep Spatio-Temporal Random Fields for Efficient Video Segmentation,39
2018,"PWC-Net: CNNs for Optical Flow Using Pyramid, Warping, and Cost Volume",1118
2018,Revisiting Deep Intrinsic Image Decompositions,60
2018,Multi-Cell Detection and Classification Using a Generative Convolutional Model,5
2018,LiteFlowNet: A Lightweight Convolutional Neural Network for Optical Flow Estimation,377
2018,VITAL: VIsual Tracking via Adversarial Learning,355
2018,Super SloMo: High Quality Estimation of Multiple Intermediate Frames for Video Interpolation,332
2018,"Real-World Repetition Estimation by Div, Grad and Curl",19
2018,Learning Intrinsic Image Decomposition From Watching the World,89
2018,Generating Synthetic X-Ray Images of a Person From the Surface Geometry,10
2018,Analytic Expressions for Probabilistic Moments of PL-DNN With Gaussian Input,24
2018,Detail-Preserving Pooling in Deep Networks,65
2018,Rethinking Feature Distribution for Loss Functions in Image Classification,106
2018,"Shift: A Zero FLOP, Zero Parameter Alternative to Spatial Convolutions",213
2018,Light Field Intrinsics With a Deep Encoder-Decoder Network,37
2018,Learning Generative ConvNets via Multi-Grid Modeling and Sampling,49
2018,Manifold Learning in Quotient Spaces,10
2018,Learning Intelligent Dialogs for Bounding Box Annotation,34
2018,Boosting Adversarial Attacks With Momentum,1030
2018,NISP: Pruning Networks Using Neuron Importance Score Propagation,479
2018,Tell Me Where to Look: Guided Attention Inference Network,283
2018,3D Semantic Segmentation With Submanifold Sparse Convolutional Networks,479
2018,Translating and Segmenting Multimodal Medical Volumes With Cycle- and Shape-Consistency Generative Adversarial Network,251
2018,An Unsupervised Learning Model for Deformable Medical Image Registration,354
2018,3D Registration of Curves and Surfaces Using Local Differential Information,11
2018,Guided Proofreading of Automatic Segmentations for Connectomics,20
2018,Learning Structure and Strength of CNN Filters for Small Sample Size Training,52
2018,The Power of Ensembles for Active Learning in Image Classification,269
2018,Learning Compact Recurrent Neural Networks With Block-Term Tensor Decomposition,74
2018,Spatially-Adaptive Filter Units for Deep Neural Networks,6
2018,SO-Net: Self-Organizing Network for Point Cloud Analysis,532
2018,SGAN: An Alternative Training of Generative Adversarial Networks,47
2018,SketchyGAN: Towards Diverse and Realistic Sketch to Image Synthesis,154
2018,Explicit Loss-Error-Aware Quantization for Low-Bit Deep Neural Networks,64
2018,Deep Image Prior,1369
2018,ST-GAN: Spatial Transformer Generative Adversarial Networks for Image Compositing,129
2019,Generating Classification Weights With GNN Denoising Autoencoders for Few-Shot Learning,131
2019,Why ReLU Networks Yield High-Confidence Predictions Far Away From the Training Data and How to Mitigate the Problem,185
2019,On the Structural Sensitivity of Deep Convolutional Networks to the Directions of Fourier Basis Functions,24
2019,Neural Rejuvenation: Improving Deep Network Training by Enhancing Computational Resource Utilization,16
2019,Auto-DeepLab: Hierarchical Neural Architecture Search for Semantic Image Segmentation,590
2019,Learning Loss for Active Learning,187
2019,BAD SLAM: Bundle Adjusted Direct RGB-D SLAM,75
2019,Revealing Scenes by Inverting Structure From Motion Reconstructions,49
2019,Strand-Accurate Multi-View Hair Capture,9
2019,DeepSDF: Learning Continuous Signed Distance Functions for Shape Representation,711
2019,Pushing the Boundaries of View Extrapolation With Multiplane Images,133
2019,GA-Net: Guided Aggregation Net for End-To-End Stereo Matching,245
2019,Real-Time Self-Adaptive Deep Stereo,116
2019,LAF-Net: Locally Adaptive Fusion Networks for Stereo Confidence Estimation,22
2019,Deep Reinforcement Learning of Volume-Guided Progressive View Inpainting for 3D Point Scene Completion From a Single Depth Image,24
2019,Video Action Transformer Network,290
2019,Timeception for Complex Action Recognition,114
2019,STEP: Spatio-Temporal Progressive Learning for Video Action Detection,60
2019,Long-Term Feature Banks for Detailed Video Understanding,236
2019,MHP-VOS: Multiple Hypotheses Propagation for Video Object Segmentation,28
2019,2.5D Visual Sound,88
2019,Gaussian Temporal Awareness Networks for Action Localization,119
2019,TopNet: Structural Point Cloud Decoder,93
2019,Perceive Where to Focus: Learning Visibility-Aware Part-Level Features for Partial Person Re-Identification,177
2019,Meta-Transfer Learning for Few-Shot Learning,459
2019,Structured Binary Neural Networks for Accurate Image Classification and Semantic Segmentation,104
2019,Graph-Based Global Reasoning Networks,232
2019,Spherical Fractal Convolutional Neural Networks for Point Cloud Recognition,69
2019,Divide and Conquer the Embedding Space for Metric Learning,65
2019,Latent Space Autoregression for Novelty Detection,178
2019,Selective Kernel Networks,584
2019,On Implicit Filter Level Sparsity in Convolutional Neural Networks,17
2019,Parametric Noise Injection: Trainable Randomness to Improve Deep Neural Network Robustness Against Adversarial Attack,104
2019,Progressive Feature Alignment for Unsupervised Domain Adaptation,157
2019,Learning a Deep ConvNet for Multi-Label Classification With Partial Labels,82
2019,Generalized Intersection Over Union: A Metric and a Loss for Bounding Box Regression,908
2019,Generalising Fine-Grained Sketch-Based Image Retrieval,36
2019,Cyclic Guidance for Weakly Supervised Joint Detection and Segmentation,55
2019,Thinking Outside the Pool: Active Training Image Creation for Relative Attributes,14
2019,Generalizable Person Re-Identification by Domain-Invariant Mapping Network,89
2019,Unsupervised Open Domain Recognition by Semantic Discrepancy Minimization,17
2019,Weakly Supervised Person Re-Identification,24
2019,PointRCNN: 3D Object Proposal Generation and Detection From Point Cloud,693
2019,Automatic Adaptation of Object Detectors to New Domains Using Self-Training,62
2019,Query-Guided End-To-End Person Search,58
2019,Libra R-CNN: Towards Balanced Learning for Object Detection,508
2019,Learning a Unified Classifier Incrementally via Rebalancing,197
2019,Feature Selective Anchor-Free Module for Single-Shot Object Detection,371
2019,SCOPS: Self-Supervised Co-Part Segmentation,42
2019,Unsupervised Moving Object Detection via Contextual Information Separation,45
2019,Pose2Seg: Detection Free Human Instance Segmentation,46
2019,DrivingStereo: A Large-Scale Dataset for Stereo Matching in Autonomous Driving Scenarios,41
2019,PartNet: A Large-Scale Benchmark for Fine-Grained and Hierarchical Part-Level 3D Object Understanding,209
2019,A Dataset and Benchmark for Large-Scale Multi-Modal Face Anti-Spoofing,76
2019,VizWiz-Priv: A Dataset for Recognizing the Presence and Purpose of Private Visual Information in Images Taken by Blind People,32
2019,Structural Relational Reasoning of Point Clouds,36
2019,MVF-Net: Multi-View 3D Face Morphable Model Regression,48
2019,Photometric Mesh Optimization for Video-Aligned 3D Object Reconstruction,35
2019,Guided Stereo Matching,38
2019,"Unsupervised Event-Based Learning of Optical Flow, Depth, and Egomotion",117
2019,Modeling Local Geometric Structure of 3D Point Clouds Using Geo-CNN,77
2019,3D Point Capsule Networks,167
2019,GS3D: An Efficient 3D Object Detection Framework for Autonomous Driving,149
2019,Single-Image Piece-Wise Planar 3D Reconstruction via Associative Embedding,35
2019,3DN: 3D Deformation Network,61
2019,Pushing the Envelope for RGB-Based Dense 3D Hand Pose Estimation via Neural Rendering,93
2019,Self-Supervised Learning of 3D Human Pose Using Multi-View Geometry,142
2019,FSA-Net: Learning Fine-Grained Structure Aggregation for Head Pose Estimation From a Single Image,111
2019,Dense 3D Face Decoding Over 2500FPS: Joint Texture & Shape Convolutional Mesh Decoders,41
2019,Linkage Based Face Clustering via Graph Convolution Network,86
2019,Towards High-Fidelity Nonlinear 3D Face Morphable Model,81
2019,BridgeNet: A Continuity-Aware Probabilistic Network for Age Estimation,46
2019,GANFIT: Generative Adversarial Network Fitting for High Fidelity 3D Face Reconstruction,140
2019,Improving the Performance of Unimodal Dynamic Hand-Gesture Recognition With Multimodal Training,68
2019,Learning to Reconstruct People in Clothing From a Single RGB Camera,142
2019,Distilled Person Re-Identification: Towards a More Scalable System,51
2019,A Perceptual Prediction Framework for Self Supervised Event Segmentation,27
2019,COIN: A Large-Scale Dataset for Comprehensive Instructional Video Analysis,60
2019,An Attention Enhanced Graph Convolutional LSTM Network for Skeleton-Based Action Recognition,307
2019,Graph Convolutional Label Noise Cleaner: Train a Plug-And-Play Action Classifier for Anomaly Detection,100
2019,AdaFrame: Adaptive Frame Selection for Fast Video Recognition,72
2019,Completeness Modeling and Context Separation for Weakly Supervised Temporal Action Localization,100
2019,Object Tracking by Reconstruction With View-Specific Discriminative Correlation Filters,31
2019,SoPhie: An Attentive GAN for Predicting Paths Compliant to Social and Physical Constraints,418
2019,Leveraging Shape Completion for 3D Siamese Tracking,37
2019,End-To-End Time-Lapse Video Synthesis From a Single Outdoor Image,20
