year,paper,citations
2019,Mode Seeking Generative Adversarial Networks for Diverse Image Synthesis,184
2019,Salient Object Detection With Pyramid Attention and Salient Edges,234
2019,Latent Filter Scaling for Multimodal Unsupervised Image-To-Image Translation,18
2019,Feedback Adversarial Learning: Spatial Feedback for Improving Generative Adversarial Networks,22
2019,MirrorGAN: Learning Text-To-Image Generation by Redescription,211
2019,Light Field Messaging With Deep Photographic Steganography,33
2019,Im2Pencil: Controllable Pencil Illustration From Photographs,23
2019,When Color Constancy Goes Wrong: Correcting Improperly White-Balanced Images,44
2019,Beyond Volumetric Albedo -- A Surface Optimization Framework for Non-Line-Of-Sight Imaging,53
2019,Reflection Removal Using a Dual-Pixel Sensor,32
2019,Practical Coding Function Design for Time-Of-Flight Imaging,9
2019,Learning Attraction Field Representation for Robust Line Segment Detection,39
2019,Blind Super-Resolution With Iterative Kernel Correction,150
2019,Attentive Feedback Network for Boundary-Aware Salient Object Detection,204
2019,Heavy Rain Image Restoration: Integrating Physics Model and Conditional Adversarial Learning,119
2019,Frame-Consistent Recurrent Video Deraining With Dual-Level Flow,44
2019,Sea-Thru: A Method for Removing Water From Underwater Images,79
2019,Deep Network Interpolation for Continuous Imagery Effect Transition,44
2019,Towards Real Scene Super-Resolution With Raw Images,62
2019,ODE-Inspired Network Design for Single Image Super-Resolution,103
2019,Attention-Guided Network for Ghost-Free High Dynamic Range Imaging,69
2019,Searching for a Robust Neural Architecture in Four GPU Hours,285
2019,Hierarchy Denoising Recursive Autoencoders for 3D Scene Layout Prediction,13
2019,Adaptively Connected Neural Networks,21
2019,CrDoCo: Pixel-Level Domain Transfer With Cross-Domain Consistency,147
2019,Temporal Cycle-Consistency Learning,119
2019,Predicting Future Frames Using Retrospective Cycle GAN,76
2019,Density Map Regression Guided Detection Network for RGB-D Crowd Counting and Localization,67
2019,Learning Semantic Segmentation From Synthetic Data: A Geometrically Guided Input-Output Adaptation Approach,115
2019,Attentive Single-Tasking of Multiple Tasks,66
2019,Self-Supervised Learning via Conditional Motion Propagation,24
2019,Revisiting Self-Supervised Visual Representation Learning,387
2019,It's Not About the Journey; It's About the Destination: Following Soft Paths Under Question-Guidance for Visual Reasoning,10
2019,Actively Seeking and Learning From Live Data,14
2019,Improving Referring Expression Grounding With Cross-Modal Attention-Guided Erasing,68
2019,Scene Graph Generation With External Knowledge and Image Reconstruction,128
2019,MUREL: Multimodal Relational Reasoning for Visual Question Answering,157
2019,Heterogeneous Memory Enhanced Multimodal Attention Model for Video Question Answering,85
2019,Information Maximizing Visual Question Generation,36
2019,Learning Words by Drawing Images,8
2019,Factor Graph Attention,57
2019,Reducing Uncertainty in Undersampled MRI Reconstruction With Active Acquisition,40
2019,ESIR: End-To-End Scene Text Recognition via Iterative Image Rectification,165
2019,ROI-10D: Monocular Lifting of 2D Detection to 6D Pose and Metric Shape,140
2019,Biologically-Constrained Graphs for Global Connectomics Reconstruction,10
2019,P3SGD: Patient Privacy Preserving SGD for Regularizing Deep CNNs in Pathological Image Classification,18
2019,Elastic Boundary Projection for 3D Medical Image Segmentation,24
2019,Noise2Void - Learning Denoising From Single Noisy Images,313
2019,Joint Discriminative and Generative Learning for Person Re-Identification,379
2019,Unsupervised Person Re-Identification by Soft Multilabel Learning,214
2019,Learning Context Graph for Person Search,92
2019,Gradient Matching Generative Networks for Zero-Shot Learning,80
2019,Doodle to Search: Practical Zero-Shot Sketch-Based Image Retrieval,59
2019,Weakly Supervised Learning of Instance Segmentation With Inter-Pixel Relations,160
2019,Attention-Based Dropout Layer for Weakly Supervised Object Localization,154
2019,Domain Generalization by Solving Jigsaw Puzzles,305
2019,Transferrable Prototypical Networks for Unsupervised Domain Adaptation,146
2019,Blending-Target Domain Adaptation by Adversarial Meta-Adaptation Networks,44
2019,C2AE: Class Conditioned Auto-Encoder for Open-Set Recognition,99
2019,Shapes and Context: In-The-Wild Image Synthesis & Manipulation,11
2019,Semantics Disentangling for Text-To-Image Generation,70
2019,Unsupervised Person Image Generation With Semantic Parsing Transformation,73
2019,Animating Arbitrary Objects via Deep Motion Transfer,124
2019,Textured Neural Avatars,60
2019,IM-Net for High Resolution Video Frame Interpolation,36
2019,Homomorphic Latent Space Interpolation for Unpaired Image-To-Image Translation,36
2019,DeepVoxels: Learning Persistent 3D Feature Embeddings,216
2019,Inverse Path Tracing for Joint Material and Lighting Estimation,53
2019,The Visual Centrifuge: Model-Free Layered Video Representations,19
2019,Label-Noise Robust Generative Adversarial Networks,44
2019,DLOW: Domain Flow for Adaptation and Generalization,136
2019,Taking a Closer Look at Domain Shift: Category-Level Adversaries for Semantics Consistent Domain Adaptation,305
2019,ADVENT: Adversarial Entropy Minimization for Domain Adaptation in Semantic Segmentation,369
2019,ContextDesc: Local Descriptor Augmentation With Cross-Modality Context,75
2019,Large-Scale Long-Tailed Recognition in an Open World,280
2019,AET vs. AED: Unsupervised Representation Learning by Auto-Encoding Transformations Rather Than Data,123
2019,SDC - Stacked Dilated Convolution: A Unified Descriptor Network for Dense Matching Tasks,36
2019,Learning Correspondence From the Cycle-Consistency of Time,230
2019,Mitigating Information Leakage in Image Representations: A Maximum Entropy Approach,39
2019,Learning Spatial Common Sense With Geometry-Aware Recurrent Networks,41
2019,Scan2CAD: Learning CAD Model Alignment in RGB-D Scans,92
2019,Tell Me Where I Am: Object-Level Scene Context Prediction,7
2019,Do Better ImageNet Models Transfer Better?,589
2019,Gotta Adapt 'Em All: Joint Pixel and Feature-Level Domain Adaptation for Recognition in the Wild,25
2019,Universal Domain Adaptation,130
2019,Hybrid-Attention Based Decoupled Metric Learning for Zero-Shot Image Retrieval,36
2019,Towards Optimal Structured CNN Pruning via Generative Adversarial Learning,205
2019,Fully Quantized Network for Object Detection,62
2019,MnasNet: Platform-Aware Neural Architecture Search for Mobile,1429
2019,"Student Becoming the Master: Knowledge Amalgamation for Joint Scene Parsing, Depth Estimation, and More",25
2019,K-Nearest Neighbors Hashing,22
2019,Bounding Box Regression With Uncertainty for Accurate Object Detection,246
2019,OCGAN: One-Class Novelty Detection Using GANs With Constrained Latent Representations,195
2019,Activity Driven Weakly Supervised Object Detection,24
2019,DistillHash: Unsupervised Deep Hashing by Distilling Data Pairs,64
2019,Region Proposal by Guided Anchoring,326
2019,Learning to Transfer Examples for Partial Domain Adaptation,109
2019,Generalized Zero-Shot Recognition Based on Visually Semantic Embedding,54
2019,Global Second-Order Pooling Convolutional Networks,87
2019,Weakly Supervised Complementary Parts Models for Fine-Grained Image Classification From the Bottom Up,94
2019,Learning-Based Sampling for Natural Image Matting,52
2019,4D Spatio-Temporal ConvNets: Minkowski Convolutional Neural Networks,355
2019,Co-Saliency Detection via Mask-Guided Fully Convolutional Networks With Multi-Scale Label Smoothing,41
2019,SAIL-VOS: Semantic Amodal Instance Level Video Object Segmentation - A Synthetic Dataset and Baselines,27
2019,A Variational Auto-Encoder Model for Stochastic Point Processes,24
2019,Unifying Heterogeneous Classifiers With Distillation,26
2019,Assessment of Faster R-CNN in Man-Machine Collaborative Search,3
2019,OK-VQA: A Visual Question Answering Benchmark Requiring External Knowledge,99
2019,Spectral Metric for Dataset Complexity Assessment,9
2019,VERI-Wild: A Large Dataset and a New Method for Vehicle Re-Identification in the Wild,109
2019,3D Local Features for Direct Pairwise Registration,56
2019,HPLFlowNet: Hierarchical Permutohedral Lattice FlowNet for Scene Flow Estimation on Large-Scale Point Clouds,64
2019,GPSfM: Global Projective SFM Using Algebraic Constraints on Multi-View Fundamental Matrices,12
2019,Multi-Level Context Ultra-Aggregation for Stereo Matching,51
2019,"Large-Scale, Metric Structure From Motion for Unordered Light Fields",14
2019,Understanding the Limitations of CNN-Based Absolute Camera Pose Regression,160
2019,DeepLiDAR: Deep Surface Normal Guided Depth Prediction for Outdoor Scene From Sparse LiDAR Data and Single Color Image,150
2019,Dense Depth Posterior (DDP) From Single Image and Sparse Range,55
2019,Veritatem Dies Aperit - Temporally Consistent Depth Prediction Enabled by a Multi-Task Geometric and Semantic Scene Understanding Approach,26
2019,Segmentation-Driven 6D Object Pose Estimation,124
2019,Exploiting Temporal Context for 3D Human Pose Estimation in the Wild,110
2019,What Do Single-View 3D Reconstruction Networks Learn?,133
2019,UniformFace: Learning Deep Equidistributed Representation for Face Recognition,60
2019,Mask-Guided Portrait Editing With Conditional GANs,48
2019,Robust Facial Landmark Detection via Occlusion-Adaptive Deep Networks,63
2019,Learning Individual Styles of Conversational Gesture,104
2019,Social Relation Recognition From Videos via Multi-Scale Spatial-Temporal Reasoning,41
2019,MS-TCN: Multi-Stage Temporal Convolutional Network for Action Segmentation,144
2019,Transferable Interactiveness Knowledge for Human-Object Interaction Detection,125
2019,Actional-Structural Graph Convolutional Networks for Skeleton-Based Action Recognition,338
2019,Deep Rigid Instance Scene Flow,65
2019,"See More, Know More: Unsupervised Video Object Segmentation With Co-Attention Siamese Networks",235
2019,Patch-Based Discriminative Feature Learning for Unsupervised Person Re-Identification,115
2019,SPM-Tracker: Series-Parallel Matching for Real-Time Visual Object Tracking,104
2019,Spatial Fusion GAN for Image Synthesis,99
2019,Towards Instance-Level Image-To-Image Translation,46
2019,Dense Intrinsic Appearance Flow for Human Pose Transfer,75
2019,Depth-Aware Video Frame Interpolation,185
2019,Sliced Wasserstein Generative Models,71
2019,Video Generation From Single Semantic Label Map,44
2019,"Zoom to Learn, Learn to Zoom",96
2019,Shape Unicode: A Unified Shape Representation,17
2019,Learning Linear Transformations for Fast Image and Video Style Transfer,57
2019,Dynamic Scene Deblurring With Parameter Selective Sharing and Nested Skip Connections,111
2019,Events-To-Video: Bringing Modern Computer Vision to Event Cameras,120
2019,EventNet: Asynchronous Recursive Event Processing,28
2019,A Simple Pooling-Based Design for Real-Time Salient Object Detection,318
2019,Contrast Prior and Fluid Pyramid Integration for RGBD Salient Object Detection,196
2019,Progressive Image Deraining Networks: A Better and Simpler Baseline,231
2019,Attentive Relational Networks for Mapping Images to Scene Graphs,78
2019,Relational Knowledge Distillation,286
2019,On the Intrinsic Dimensionality of Image Representations,25
2019,Self-Supervised Spatio-Temporal Representation Learning for Videos by Predicting Motion and Appearance Statistics,116
2019,Classification-Reconstruction Learning for Open-Set Recognition,106
2019,Adversarial Structure Matching for Structured Prediction Tasks,19
2019,Deep Asymmetric Metric Learning via Rich Relationship Mining,22
2019,Scene Categorization From Contours: Medial Axis Based Salience Measures,15
2019,Iterative Alignment Network for Continuous Sign Language Recognition,67
2019,Neural Sequential Phrase Grounding (SeqGROUND),29
2019,MSCap: Multi-Style Image Captioning With Unpaired Stylized Text,40
2019,Networks for Joint Affine and Non-Parametric Image Registration,47
2019,Learning Shape-Aware Embedding for Scene Text Detection,79
2019,Pay Attention! - Robustifying a Deep Visuomotor Policy Through Task-Focused Visual Attention,20
2019,Deep Blind Video Decaptioning by Temporal Aggregation and Recurrence,13
2019,Adversarial Attacks Beyond the Image Space,86
2019,Evading Defenses to Transferable Adversarial Examples by Translation-Invariant Attacks,199
2019,Decoupling Direction and Norm for Efficient Gradient-Based L2 Adversarial Attacks and Defenses,149
2019,Learning to Quantize Deep Networks by Optimizing Quantization Intervals With Task Loss,164
2019,Unsupervised Learning of Dense Shape Correspondence,71
2019,Balanced Self-Paced Learning for Generative Adversarial Clustering Network,46
2019,A Style-Based Generator Architecture for Generative Adversarial Networks,2548
2019,Parallel Optimal Transport GAN,9
2019,3D-SIS: 3D Semantic Instance Segmentation of RGB-D Scans,184
2019,Occupancy Networks: Learning 3D Reconstruction in Function Space,650
2019,SiCloPe: Silhouette-Based Clothed People,96
2019,Convolutional Mesh Regression for Single-Image Human Shape Reconstruction,208
2019,H+O: Unified Egocentric Recognition of 3D Hand-Object Poses and Interactions,106
2019,Learning the Depths of Moving People by Watching Frozen People,120
2019,Extreme Relative Pose Estimation for RGB-D Scans via Scene Completion,15
2019,A Skeleton-Bridged Deep Learning Approach for Generating Meshes of Complex Topologies From Single RGB Images,38
2019,Learning Structure-And-Motion-Aware Rolling Shutter Correction,23
2019,PVNet: Pixel-Wise Voting Network for 6DoF Pose Estimation,312
2019,Deeper and Wider Siamese Networks for Real-Time Visual Tracking,377
2019,Diverse Generation for Multi-Agent Sports Games,38
2019,GFrames: Gradient-Based Local Reference Frame for 3D Shape Matching,14
2019,Eliminating Exposure Bias and Metric Mismatch in Multiple Object Tracking,58
2019,ATOM: Accurate Tracking by Overlap Maximization,394
2019,Visual Tracking via Adaptive Spatially-Regularized Correlation Filters,193
2019,Deep Tree Learning for Zero-Shot Face Anti-Spoofing,102
2019,ArcFace: Additive Angular Margin Loss for Deep Face Recognition,2120
2019,Learning Joint Gait Representation via Quintuplet Loss Minimization,33
2019,Gait Recognition via Disentangled Representation Learning,86
2019,Reversible GANs for Memory-Efficient Image-To-Image Translation,19
2019,Sensitive-Sample Fingerprinting of Deep Neural Networks,19
2019,Handwriting Recognition in Low-Resource Scripts Using Adversarial Learning,36
2019,Adversarial Defense Through Network Profiling Based Path Extraction,19
2019,SpotTune: Transfer Learning Through Adaptive Fine-Tuning,143
2019,Signal-To-Noise Ratio: A Robust Distance Metric for Deep Metric Learning,28
2019,Detection Based Defense Against Adversarial Examples From the Steganalysis Point of View,50
2019,HetConv: Heterogeneous Kernel-Based Convolutions for Deep CNNs,49
2019,Strike (With) a Pose: Neural Networks Are Easily Fooled by Strange Poses of Familiar Objects,141
2019,Instance-Level Meta Normalization,14
2019,LP-3DCNN: Unveiling Local Phase in 3D Convolutional Neural Networks,39
2019,Attribute-Driven Feature Disentangling and Temporal Aggregation for Video Person Re-Identification,75
2019,Knockoff Nets: Stealing Functionality of Black-Box Models,152
2019,Deep Embedding Learning With Discriminative Sampling Policy,29
2019,Looking for the Devil in the Details: Learning Trilinear Attention Sampling Network for Fine-Grained Image Recognition,167
2019,Domain-Symmetric Networks for Adversarial Domain Adaptation,148
2019,Label Propagation for Deep Semi-Supervised Learning,248
2019,Context-Aware Crowd Counting,250
2019,Detect-To-Retrieve: Efficient Regional Aggregation for Image Search,55
2019,On Exploring Undetermined Relationships for Visual Relationship Detection,46
2019,Learning Without Memorizing,114
2019,Dynamic Recursive Neural Network,16
2019,RepMet: Representative-Based Metric Learning for Classification and Few-Shot Object Detection,154
2019,Ranked List Loss for Deep Metric Learning,116
2019,Precise Detection in Densely Packed Scenes,70
2019,KE-GAN: Knowledge Embedded Generative Adversarial Networks for Semi-Supervised Scene Parsing,20
2019,Fast User-Guided Video Object Segmentation by Interaction-And-Propagation Networks,28
2019,FickleNet: Weakly and Semi-Supervised Semantic Image Segmentation Using Stochastic Inference,180
2019,DeepFlux for Skeletons in the Wild,27
2019,Interactive Image Segmentation via Backpropagating Refinement Scheme,59
2019,Scene Parsing via Integrated Classification Model and Variance-Based Regularization,2
2019,Surface Reconstruction From Normals: A Robust DGP-Based Discontinuity Preservation Approach,5
2019,Jumping Manifolds: Geometry Aware Dense Non-Rigid Structure From Motion,21
2019,LVIS: A Dataset for Large Vocabulary Instance Segmentation,227
2019,Fast Object Class Labelling via Speech,6
2019,Creative Flow+ Dataset,9
2019,Weakly Supervised Open-Set Domain Adaptation by Dual-Domain Collaboration,12
2019,A Neurobiological Evaluation Metric for Neural Network Model Search,5
2019,Iterative Projection and Matching: Finding Structure-Preserving Representatives and Its Application to Computer Vision,10
2019,A Bayesian Perspective on the Deep Image Prior,59
2019,ApolloCar3D: A Large 3D Car Instance Understanding Benchmark for Autonomous Driving,59
2019,Self-Supervised Convolutional Subspace Clustering Network,64
2019,Multi-Scale Geometric Consistency Guided Multi-View Stereo,52
2019,Hierarchical Deep Stereo Matching on High-Resolution Images,70
2019,The Perfect Match: 3D Point Cloud Matching With Smoothed Densities,142
2019,PointWeb: Enhancing Local Neighborhood Features for Point Cloud Processing,195
2019,Scan2Mesh: From Unstructured Range Scans to 3D Meshes,45
2019,Unsupervised Domain Adaptation for ToF Data Denoising With Adversarial Learning,17
2019,Learning Independent Object Motion From Unlabelled Stereoscopic Videos,12
2019,Learning 3D Human Dynamics From Video,198
2019,Visual Localization by Learning Objects-Of-Interest Dense Match Regression,18
2019,A Compact Embedding for Facial Expression Similarity,44
2019,Unsupervised 3D Pose Estimation With Geometric Self-Supervision,88
2019,Peeking Into the Future: Predicting Future Person Activities and Locations in Videos,176
2019,Iterative Residual Refinement for Joint Optical Flow and Occlusion Estimation,104
2019,Led3D: A Lightweight and Efficient Deep Approach to Recognizing Low-Quality 3D Faces,19
2019,Deep Video Inpainting,79
2019,Non-Adversarial Image Synthesis With Generative Latent Nearest Neighbors,38
2019,Mixture Density Generative Adversarial Networks,26
2019,Art2Real: Unfolding the Reality of Artworks via Semantically-Aware Image-To-Image Translation,60
2019,Photo Wake-Up: 3D Character Animation From a Single Photo,58
2019,DeepLight: Learning Illumination for Unconstrained Mobile Mixed Reality,53
2019,Iterative Residual CNNs for Burst Photography Applications,20
2019,Turn a Silicon Camera Into an InGaAs Camera,2
2019,Joint Representative Selection and Feature Learning: A Semi-Supervised Approach,2
2019,The Domain Transform Solver,4
2019,Phase-Only Image Based Kernel Estimation for Single Image Blind Deblurring,28
2019,FOCNet: A Fractional Optimal Control Network for Image Denoising,49
2019,Combinatorial Persistency Criteria for Multicut and Max-Cut,5
2019,Cross-Atlas Convolution for Parameterization Invariant Learning on Textured Mesh Surface,8
2019,Knowledge-Embedded Routing Network for Scene Graph Generation,130
2019,Fast and Flexible Indoor Scene Synthesis via Deep Convolutional Generative Models,63
2019,Scale-Adaptive Neural Dense Features: Learning via Hierarchical Context Aggregation,4
2019,Unsupervised Embedding Learning via Invariant and Spreading Instance Feature,212
2019,AOGNets: Compositional Grammatical Architectures for Deep Learning,24
2019,Context and Attribute Grounded Dense Captioning,22
2019,Interpreting CNNs via Decision Trees,170
2019,Synthesizing Environment-Aware Activities via Activity Sketches,9
2019,Self-Critical N-Step Training for Image Captioning,29
2019,Multi-Target Embodied Question Answering,35
2019,StoryGAN: A Sequential Conditional GAN for Story Visualization,67
2019,L3-Net: Towards Learning Based LiDAR Localization for Autonomous Driving,94
2019,Mask Scoring R-CNN,383
2019,Sampling Techniques for Large-Scale Object Detection From Sparsely Annotated Objects,13
2019,Barrage of Random Transforms for Adversarially Robust Defense,64
2019,Aggregation Cross-Entropy for Sequence Recognition,48
2019,LaSO: Label-Set Operations Networks for Multi-Label Few-Shot Learning,50
2019,Few-Shot Learning With Localization in Realistic Settings,79
2019,Grounded Video Description,92
2019,Streamlined Dense Video Captioning,54
2019,Learning to Compose Dynamic Tree Structures for Visual Contexts,127
2019,Cycle-Consistency for Robust Visual Question Answering,83
2019,Embodied Question Answering in Photorealistic Environments With Point Cloud Perception,58
2019,Recursive Visual Attention in Visual Dialog,68
2019,Two Body Problem: Collaborative Visual Task Completion,31
2019,Text2Scene: Generating Compositional Scenes From Textual Descriptions,43
2019,From Recognition to Cognition: Visual Commonsense Reasoning,280
2019,The Regretful Agent: Heuristic-Aided Navigation Through Progress Estimation,94
2019,Tactical Rewind: Self-Correction via Backtracking in Vision-And-Language Navigation,90
2019,Learning to Learn How to Learn: Self-Adaptive Visual Navigation Using Meta-Learning,87
2019,High Flux Passive Imaging With Single-Photon Sensors,23
2019,Steady-State Non-Line-Of-Sight Imaging,29
2019,A Theory of Fermat Paths for Non-Line-Of-Sight Shape Reconstruction,87
2019,End-To-End Projector Photometric Compensation,12
2019,Bringing a Blurry Frame Alive at High Frame-Rate With an Event Camera,61
2019,Bringing Alive Blurred Moments,34
2019,Blind Visual Motif Removal From a Single Image,6
2019,Neural Rerendering in the Wild,105
2019,MeshAdv: Adversarial Meshes for Visual Recognition,64
2019,Fast Spatially-Varying Indoor Lighting Estimation,51
2019,Neural Illumination: Lighting Prediction for Indoor Environments,54
2019,Deep Sky Modeling for Single Image Outdoor Lighting Estimation,47
2019,Strong-Weak Distribution Alignment for Adaptive Object Detection,175
2019,MFAS: Multimodal Fusion Architecture Search,74
2019,Disentangling Adversarial Robustness and Generalization,116
2019,ShieldNets: Defending Against Adversarial Attacks Using Probabilistic Adversarial Robustness,18
2019,Attention-Guided Unified Network for Panoptic Segmentation,141
2019,NAS-FPN: Learning Scalable Feature Pyramid Architecture for Object Detection,561
2019,OICSR: Out-In-Channel Sparsity Regularization for Compact Deep Neural Networks,36
2019,Semantically Aligned Bias Reducing Zero Shot Learning,44
2019,Feature Space Perturbations Yield More Transferable Adversarial Examples,69
2019,IGE-Net: Inverse Graphics Energy Networks for Human Pose Estimation and Single-View Reconstruction,3
2019,PPGNet: Learning Point-Pair Graph for Line Segment Detection,29
2019,AANet: Attribute Attention Network for Person Re-Identifications,165
2019,Overcoming Limitations of Mixture Density Networks: A Sampling and Fitting Framework for Multimodal Future Prediction,85
2019,VRSTC: Occlusion-Free Video Person Re-Identification,85
2019,Moving Object Detection Under Discontinuous Change in Illumination Using Tensor Low-Rank and Invariant Sparse Decomposition,8
2019,Pedestrian Detection With Autoregressive Network Phases,48
2019,Stochastic Class-Based Hard Example Mining for Deep Metric Learning,49
2019,Revisiting Perspective Information for Efficient Crowd Counting,142
2019,Ensemble Deep Manifold Similarity Learning Using Hard Proxies,21
2019,Occlusion-Net: 2D/3D Occluded Keypoint Localization Using Graph Networks,25
2019,Domain-Specific Batch Normalization for Unsupervised Domain Adaptation,151
2019,Triply Supervised Decoder Networks for Joint Detection and Segmentation,48
2019,Exploring the Bounds of the Utility of Context for Object Detection,21
2019,Point Cloud Oversegmentation With Graph-Structured Deep Metric Learning,70
2019,Adaptive Pyramid Context Network for Semantic Segmentation,117
2019,"Isospectralization, or How to Hear Shape, Style, and Correspondence",29
2019,Speech2Face: Learning the Face Behind a Voice,82
2019,Audio Visual Scene-Aware Dialog,59
2019,Depth From a Polarisation + RGB Stereo Pair,29
2019,Rethinking the Evaluation of Video Summaries,49
2019,What Object Should I Use? - Task Driven Object Detection,4
2019,Triangulation Learning Network: From Monocular to Stereo 3D Object Detection,52
2019,Connecting the Dots: Learning Representations for Active Monocular Depth Estimation,14
2019,Stereo R-CNN Based 3D Object Detection for Autonomous Driving,216
2019,Hybrid Scene Compression for Visual Localization,24
2019,MMFace: A Multi-Metric Regression Network for Unconstrained Face Reconstruction,26
2019,Single Image Depth Estimation Trained via Depth From Defocus Cues,53
2019,Neural Scene Decomposition for Multi-Person Motion Capture,27
2019,Efficient Decision-Based Black-Box Adversarial Attacks on Face Recognition,146
2019,FA-RPN: Floating Region Proposals for Face Detection,26
2019,Mixed Effects Neural Networks (MeNets) With Applications to Gaze Estimation,31
2019,3D Human Pose Estimation in Video With Temporal Convolutions and Semi-Supervised Training,361
