year,paper,citations
2019,Is Deeper Better only when Shallow is Good?,22
2019,Deep Leakage from Gradients,329
2019,Pure Exploration with Multiple Correct Answers,26
2019,The Thermodynamic Variational Objective,18
2019,Learning Imbalanced Datasets with Label-Distribution-Aware Margin Loss,294
2019,"Learning and Generalization in Overparameterized Neural Networks, Going Beyond Two Layers",428
2019,Approximation Ratios of Graph Neural Networks for Combinatorial Problems,36
2019,Variational Denoising Network: Toward Blind Noise Modeling and Removal,69
2019,Multi-task Learning for Aggregated Data using Gaussian Processes,13
2019,Keeping Your Distance: Solving Sparse Reward Tasks Using Self-Balancing Shaped Rewards,35
2019,Efficient characterization of electrically evoked responses for neural interfaces,2
2019,The Synthesis of XNOR Recurrent Neural Networks with Stochastic Logic,6
2019,McDiarmid-Type Inequalities for Graph-Dependent Variables and Stability Bounds,5
2019,Are deep ResNets provably better than linear predictors?,7
2019,Hyperparameter Learning via Distributional Transfer,13
2019,Levenshtein Transformer,147
2019,Enhancing the Locality and Breaking the Memory Bottleneck of Transformer on Time Series Forecasting,155
2019,Updates of Equilibrium Prop Match Gradients of Backprop Through Time in an RNN with Static Input,18
2019,Image Captioning: Transforming Objects into Words,113
2019,Uncoupled Regression from Pairwise Comparison Data,6
2019,No-Regret Learning in Unknown Games with Correlated Payoffs,13
2019,Semantic Conditioned Dynamic Modulation for Temporal Sentence Grounding in Videos,61
2019,Structured Variational Inference in Continuous Cox Process Models,5
2019,Channel Gating Neural Networks,67
2019,Rethinking Generative Mode Coverage: A Pointwise Guaranteed Approach,8
2019,A Domain Agnostic Measure for Monitoring and Evaluating GANs,21
2019,Enabling hyperparameter optimization in sequential autoencoders for spiking neural data,11
2019,Grid Saliency for Context Explanations of Semantic Segmentation,13
2019,DM2C: Deep Mixed-Modal Clustering,12
2019,Fast AutoAugment,249
2019,Variance Reduction for Matrix Games,28
2019,Efficient Forward Architecture Search,20
2019,"Poincaré Recurrence, Cycles and Spurious Equilibria in Gradient-Descent-Ascent for Non-Convex Non-Concave Zero-Sum Games",34
2019,End-to-End Learning on 3D Protein Structure for Interface Prediction,35
2019,Positional Normalization,36
2019,Efficient Probabilistic Inference in the Quest for Physics Beyond the Standard Model,27
2019,Algorithm-Dependent Generalization Bounds for Overparameterized Deep Residual Networks,14
2019,A unified theory for the origin of grid cells through the lens of pattern formation,28
2019,Functional Adversarial Attacks,57
2019,Learning search spaces for Bayesian optimization: Another view of hyperparameter transfer learning,38
2019,Image Synthesis with a Single (Robust) Classifier,88
2019,Unsupervised State Representation Learning in Atari,101
2019,Meta Learning with Relational Information for Short Sequences,11
2019,Private Learning Implies Online Learning: An Efficient Reduction,10
2019,Kernel quadrature with DPPs,19
2019,Learning Temporal Pose Estimation from Sparsely-Labeled Videos,37
2019,Learning Generalizable Device Placement Algorithms for Distributed Machine Learning,14
2019,On the equivalence between graph isomorphism testing and function approximation with GNNs,90
2019,SPoC: Search-based Pseudocode to Code,23
2019,Oblivious Sampling Algorithms for Private Data Analysis,7
2019,On Relating Explanations and Adversarial Examples,49
2019,Greedy Sampling for Approximate Clustering in the Presence of Outliers,10
2019,Understanding the Representation Power of Graph Neural Networks in Learning Graph Topology,60
2019,Single-Model Uncertainties for Deep Learning,104
2019,Wasserstein Weisfeiler-Lehman Graph Kernels,73
2019,DATA: Differentiable ArchiTecture Approximation,33
2019,Fast Structured Decoding for Sequence Models,47
2019,Comparison Against Task Driven Artificial Neural Networks Reveals Functional Properties in Mouse Visual Cortex,13
2019,Interpreting and improving natural-language processing (in machines) with  natural language-processing (in the brain),56
2019,Adversarial training for free!,425
2019,Guided Similarity Separation for Image Retrieval,16
2019,Rethinking Deep Neural Network Ownership Verification: Embedding Passports to Defeat Ambiguity Attacks,54
2019,Addressing Failure Prediction by Learning Model Confidence,68
2019,Towards Automatic Concept-based Explanations,160
2019,Brain-Like Object Recognition with High-Performing Shallow Recurrent ANNs,76
2019,Logarithmic Regret for Online Control,55
2019,Offline Contextual Bayesian Optimization,5
2019,Uncertainty on Asynchronous Time Event Prediction,13
2019,Hierarchical Decision Making by Generating and Following Natural Language Instructions,26
2019,Accelerating Rescaled Gradient Descent: Fast Optimization of Smooth Functions,23
2019,Reconciling meta-learning and continual learning with online mixtures of tasks,62
2019,Neural Spline Flows,165
2019,Embedding Symbolic Knowledge into Deep Networks,19
2019,Sparse Variational Inference: Bayesian Coresets from Scratch,11
2019,Learning Hierarchical Priors in VAEs,31
2019,From voxels to pixels and back: Self-supervision in natural-image reconstruction from fMRI,14
2019,Reverse KL-Divergence Training of Prior Networks: Improved Uncertainty and Adversarial Robustness,49
2019,Adversarial Fisher Vectors for Unsupervised Representation Learning,5
2019,Dichotomize and Generalize: PAC-Bayesian Binary Activated Deep Neural Networks,18
2019,Coresets for Archetypal Analysis,4
2019,List-decodable Linear Regression,39
2019,Infra-slow brain dynamics as a marker for cognitive function and decline,1
2019,Statistical Analysis of Nearest Neighbor Methods for Anomaly Detection,25
2019,Full-Gradient Representation for Neural Network Visualization,56
2019,The Implicit Metropolis-Hastings Algorithm,4
2019,Coresets for Clustering with Fairness Constraints,43
2019,Rethinking the CSC Model for Natural Images,28
2019,Max-value Entropy Search for Multi-Objective Bayesian Optimization,47
2019,Algorithmic Guarantees for Inverse Imaging with Untrained Network Priors,27
2019,Failing Loudly: An Empirical Study of Methods for Detecting Dataset Shift,81
2019,Shadowing Properties of Optimization Algorithms,10
2019,Bayesian Batch Active Learning as Sparse Subset Approximation,54
2019,On the Ineffectiveness of Variance Reduced Optimization for Deep Learning,60
2019,Putting An End to End-to-End: Gradient-Isolated Learning of Representations,56
2019,Modular Universal Reparameterization: Deep Multi-task Learning Across Diverse Domains,14
2019,Decentralized Cooperative Stochastic Bandits,46
2019,Powerset Convolutional Neural Networks,13
2019,"Non-Stationary Markov Decision Processes, a Worst-Case Approach using Model-Based Reinforcement Learning",24
2019,Continual Unsupervised Representation Learning,88
2019,Multiple Futures Prediction,128
2019,Multiview Aggregation for Learning Category-Specific Shape Reconstruction,24
2019,Reinforcement Learning with Convex Constraints,35
2019,Learning Hawkes Processes from a handful of events,16
2019,"Accurate, reliable and fast robustness evaluation",44
2019,"UniXGrad: A Universal, Adaptive Algorithm with Optimal Guarantees for Constrained Optimization",17
2019,Third-Person Visual Imitation Learning via Decoupled Hierarchical Controller,29
2019,Learning from Bad Data via Generation,6
2019,Hierarchical Optimal Transport for Document Representation,36
2019,PerspectiveNet: A Scene-consistent Image Generator for New View Synthesis in Real Indoor Environments,8
2019,End to end learning and optimization on graphs,29
2019,Robust Bi-Tempered Logistic Loss Based on Bregman Divergences,51
2019,Non-Asymptotic Pure Exploration by Solving Games,32
2019,Perceiving the arrow of time in autoregressive motion,2
2019,Decentralized sketching of low rank matrices,6
2019,Private Testing of Distributions via Sample Permutations,12
2019,Selecting Optimal Decisions via Distributionally Robust Nearest-Neighbor Regression,7
2019,Adapting Neural Networks for the Estimation of Treatment Effects,73
2019,Solving graph compression via optimal transport,10
2019,Incremental Scene Synthesis,2
2019,Computing Linear Restrictions of Neural Networks,10
2019,Limiting Extrapolation in Linear Approximate Value Iteration,18
2019,Finding Friend and Foe in Multi-Agent Games,19
2019,Layer-Dependent Importance Sampling for Training Deep and Large Graph Convolutional Networks,66
2019,Data Parameters: A New Family of Parameters for Learning a Differentiable Curriculum,32
2019,Multi-Resolution Weak Supervision for Sequential Data,12
2019,Maximum Mean Discrepancy Gradient Flow,41
2019,Causal Confusion in Imitation Learning,85
2019,MCP: Learning Composable Hierarchical Control with Multiplicative Compositional Policies,72
2019,Screening Sinkhorn Algorithm for Regularized Optimal Transport,20
2019,Learning Deep Bilinear Transformation for Fine-grained Image Representation,38
2019,Learning Compositional Neural Programs with Recursive Tree Search and Planning,25
2019,Efficient and Accurate Estimation of Lipschitz Constants for Deep Neural Networks,131
2019,Bipartite expander Hopfield networks as self-decoding high-capacity error correcting codes,8
2019,Provably Global Convergence of Actor-Critic: A Case for Linear Quadratic Regulator with Ergodic Cost,32
2019,Deep ReLU Networks Have Surprisingly Few Activation Patterns,74
2019,ObjectNet: A large-scale bias-controlled dataset for pushing the limits of object recognition models,117
2019,The Point Where Reality Meets Fantasy: Mixed Adversarial Generators for Image Splice Detection,21
2019,Recovering Bandits,17
2019,A neurally plausible model for online recognition and postdiction in a dynamical environment,4
2019,Importance Resampling for Off-policy Prediction,19
2019,MaxGap Bandit: Adaptive Algorithms for Approximate Ranking,1
2019,Exact Rate-Distortion in Autoencoders via Echo Noise,9
2019,BIVA: A Very Deep Hierarchy of Latent Variables for Generative Modeling,83
2019,Bridging Machine Learning and Logical Reasoning by Abductive Learning,37
2019,Variational Structured Semantic Inference for Diverse Image Captioning,13
2019,Input-Output Equivalence of Unitary and Contractive RNNs,2
2019,Latent Weights Do Not Exist: Rethinking Binarized Neural Network Optimization,50
2019,Continuous-time Models for Stochastic Optimization Algorithms,10
2019,A Zero-Positive Learning Approach for Diagnosing Software Performance Regressions,16
2019,Non-normal Recurrent Neural Network (nnRNN): learning long time dependencies while improving expressivity with transient dynamics,31
2019,Large Memory Layers with Product Keys,66
2019,AttentionXML: Label Tree-based Attention-Aware Deep Model for High-Performance Extreme Multi-Label Text Classification,127
2019,Policy Learning for Fairness in Ranking,79
2019,Integer Discrete Flows and Lossless Compression,56
2019,Generative Well-intentioned Networks,3
2019,An Embedding Framework for Consistent Polyhedral Surrogates,7
2019,The Normalization Method for Alleviating Pathological Sharpness in Wide Neural Networks,17
2019,Reconciling λ-Returns with Experience Replay,16
2019,Finite-Sample Analysis for SARSA with Linear Function Approximation,86
2019,Network Pruning via Transformable Architecture Search,119
2019,Selective Sampling-based Scalable Sparse Subspace Clustering,20
2019,On the Expressive Power of Deep Polynomial Neural Networks,31
2019,BehaveNet: nonlinear embedding and Bayesian neural decoding of behavioral videos,32
2019,Accurate Layerwise Interpretable Competence Estimation,3
2019,On the Global Convergence of (Fast) Incremental Expectation Maximization Methods,16
2019,Gossip-based Actor-Learner Architectures for Deep Reinforcement Learning,15
2019,Learning Latent Process from High-Dimensional Event Sequences via Efficient Sampling,7
2019,Using Self-Supervised Learning Can Improve Model Robustness and Uncertainty,277
2019,Space and Time Efficient Kernel Density Estimation in High Dimensions,23
2019,One ticket to win them all: generalizing lottery ticket initializations across datasets and optimizers,97
2019,Symmetry-adapted generation of 3d point sets for the targeted discovery of molecules,45
2019,Combining Generative and Discriminative Models for Hybrid Inference,18
2019,Region Mutual Information Loss for Semantic Segmentation,31
2019,Variational Graph Recurrent Neural Networks,46
2019,Stochastic Bandits with Context Distributions,5
2019,Training Language GANs from Scratch,37
2019,Foundations of Comparison-Based Hierarchical Clustering,18
2019,On the Accuracy of Influence Functions for Measuring Group Effects,60
2019,Neural Similarity Learning,12
2019,Multi-objective Bayesian optimisation with preferences over objectives,13
2019,The Case for Evaluating Causal Models Using Interventional Measures and Empirical Data,24
2019,Spatially Aggregated Gaussian Processes with Multivariate Areal Outputs,14
2019,Seeing the Wind: Visual Wind Speed Prediction with a Coupled Convolutional and Recurrent Neural Network,8
2019,Hyper-Graph-Network Decoders for Block Codes,23
2019,Coordinated hippocampal-entorhinal replay as structural inference,4
2019,Invert to Learn to Invert,46
2019,Optimal Sparse Decision Trees,66
2019,This Looks Like That: Deep Learning for Interpretable Image Recognition,253
2019,Fast Parallel Algorithms for Statistical Subset Selection Problems,5
2019,On Lazy Training in Differentiable Programming,337
2019,Using Embeddings to Correct for Unobserved Confounding in Networks,27
2019,Emergence of Object Segmentation in Perturbed Generative Models,34
2019,On the Optimality of Perturbations in Stochastic and Adversarial Multi-armed Bandit Problems,10
2019,Deep imitation learning for molecular inverse problems,4
2019,Ease-of-Teaching and Language Structure from Emergent Communication,41
2019,Distributed estimation of the inverse Hessian by determinantal averaging,12
2019,muSSP: Efficient Min-cost Flow Algorithm for Multi-object Tracking,8
2019,Controlling Neural Level Sets,32
2019,Learning GANs and Ensembles Using Discrepancy,6
2019,Neural Relational Inference with Fast Modular Meta-learning,25
2019,Identification of Conditional Causal Effects under Markov Equivalence,6
2019,Learning to Predict Layout-to-image Conditional Convolutions for Semantic Image Synthesis,71
2019,Piecewise Strong Convexity of Neural Networks,8
2019,No Pressure! Addressing the Problem of Local Minima in Manifold Learning Algorithms,0
2019,Approximate Inference Turns Deep Networks into Gaussian Processes,33
2019,SGD on Neural Networks Learns Functions of Increasing Complexity,70
2019,Visualizing the PHATE of Neural Networks,12
2019,Gate Decorator: Global Filter Pruning Method for Accelerating Deep Convolutional Neural Networks,94
2019,Practical Deep Learning with Bayesian Principles,102
2019,Deep Active Learning with a Neural Architecture Search,22
2019,Quality Aware Generative Adversarial Networks,8
2019,Off-Policy Evaluation via Off-Policy Classification,27
2019,Variational Temporal Abstraction,16
2019,Scene Representation Networks: Continuous 3D-Structure-Aware Neural Scene Representations,311
2019,Control What You Can: Intrinsically Motivated Task-Planning Agent,10
2019,Adversarial Self-Defense for Cycle-Consistent GANs,19
2019,Ultrametric Fitting by Gradient Descent,20
2019,PerspectiveNet: 3D Object Detection from a Single RGB Image via Perspective Points,12
2019,Beyond Confidence Regions: Tight Bayesian Ambiguity Sets for Robust MDPs,19
2019,Spatial-Aware Feature Aggregation for Image based Cross-View Geo-Localization,32
2019,Leveraging Labeled and Unlabeled Data for Consistent Fair Binary Classification,18
2019,Minimum Stein Discrepancy Estimators,37
2019,Explanations can be manipulated and geometry is to blame,103
2019,Input-Cell Attention Reduces Vanishing Saliency of Recurrent Neural Networks,13
2019,Paradoxes in Fair Machine Learning,12
2019,Learning Conditional Deformable Templates with Convolutional Networks,50
2019,Volumetric Correspondence Networks for Optical Flow,73
2019,Variance Reduction in Bipartite Experiments through Correlation Clustering,18
2019,Attribution-Based Confidence Metric For Deep Neural Networks,24
2019,Are Disentangled Representations Helpful for Abstract Visual Reasoning?,83
2019,Beyond Alternating Updates for Matrix Factorization with Inertial Bregman Proximal Gradient Algorithms,13
2019,Towards Explaining the Regularization Effect of Initial Large Learning Rate in Training Neural Networks,110
2019,"PyTorch: An Imperative Style, High-Performance Deep Learning Library",18697
2019,Learning to Infer Implicit Surfaces without 3D Supervision,78
2019,Are Labels Required for Improving Adversarial Robustness?,144
2019,Stochastic Frank-Wolfe for Composite Convex Minimization,13
2019,Modeling Dynamic Functional Connectivity with Latent Factor Gaussian Processes,4
2019,ETNet: Error Transition Network for Arbitrary Style Transfer,13
2019,Cross-lingual Language Model Pretraining,1285
2019,Icebreaker: Element-wise Efficient Information Acquisition with a Bayesian Deep Latent Gaussian Model,9
2019,Efficient and Thrifty Voting by Any Means Necessary,26
2019,Crowdsourcing via Pairwise Co-occurrences: Identifiability and Algorithms,16
2019,Limitations of Lazy Training of Two-layers Neural Network,64
2019,Scalable Bayesian inference of dendritic voltage via spatiotemporal recurrent state space models,0
2019,Constrained Reinforcement Learning Has Zero Duality Gap,46
2019,Metric Learning for Adversarial Robustness,72
2019,Learning to Control Self-Assembling Morphologies: A Study of Generalization via Modularity,37
2019,Alleviating Label Switching with Optimal Transport,5
2019,Domes to Drones: Self-Supervised Active Triangulation for 3D Human Pose Reconstruction,13
2019,SIC-MMAB: Synchronisation Involves Communication in Multiplayer Multi-Armed Bandits,56
2019,A Step Toward Quantifying Independently Reproducible Machine Learning Research,33
2019,Manipulating a Learning Defender and Ways to Counteract,7
2019,Privacy Amplification by Mixing and Diffusion Mechanisms,20
2019,Ultra Fast Medoid Identification via Correlated Sequential Halving,8
2019,On the Inductive Bias of Neural Tangent Kernels,93
2019,Implicit Regularization of Accelerated Methods in Hilbert Spaces,11
2019,Transfer Learning via Minimizing the Performance Gap Between Domains,17
2019,ViLBERT: Pretraining Task-Agnostic Visiolinguistic Representations for Vision-and-Language Tasks,783
2019,Planning with Goal-Conditioned Policies,59
2019,Goal-conditioned Imitation Learning,62
2019,Superset Technique for Approximate Recovery in One-Bit Compressed Sensing,7
2019,Iterative Least Trimmed Squares for Mixed Linear Regression,13
2019,Time-series Generative Adversarial Networks,120
2019,Learning Nonsymmetric Determinantal Point Processes,21
2019,Quantum Embedding of Knowledge for Reasoning,15
2019,Online Normalization for Training Neural Networks,27
2019,Equitable Stable Matchings in Quadratic Time,4
2019,A New Defense Against Adversarial Images: Turning a Weakness into a Strength,51
2019,Break the Ceiling: Stronger Multi-scale Deep Graph Convolutional Networks,53
2019,On Human-Aligned Risk Minimization,7
2019,Robustness Verification of Tree-based Models,26
2019,Multi-label Co-regularization for Semi-supervised Facial Action Unit Recognition,28
2019,A Primal Dual Formulation For Deep Learning With Constraints,19
2019,DualDICE: Behavior-Agnostic Estimation of Discounted Stationary Distribution Corrections,106
2019,Intrinsic dimension of data representations in deep neural networks,62
2019,Data-driven Estimation of Sinusoid Frequencies,13
2019,Discovering Neural Wirings,51
2019,Locally Private Learning without Interaction Requires Separation,14
2019,Fixing the train-test resolution discrepancy,191
2019,Quadratic Video Interpolation,44
2019,Efficient Graph Generation with Graph Recurrent Attention Networks,110
2019,Social-BiGAT: Multimodal Trajectory Forecasting using Bicycle-GAN and Graph Attention Networks,187
2019,Re-examination of the Role of Latent Variables in Sequence Modeling,3
2019,Consistency-based Semi-supervised Learning for Object detection,79
2019,Kernel Truncated Randomized Ridge Regression: Optimal Rates and Low Noise Acceleration,8
2019,Exact Combinatorial Optimization with Graph Convolutional Neural Networks,100
2019,Comparing Unsupervised Word Translation Methods Step by Step,5
2019,"Learn, Imagine and Create: Text-to-Image Generation from Prior Knowledge",37
2019,Compiler Auto-Vectorization with Imitation Learning,18
2019,Fast Sparse Group Lasso,12
2019,Deep Random Splines for Point Process Intensity Estimation of Neural Population Data,5
2019,Deep Signature Transforms,51
2019,Guided Meta-Policy Search,38
2019,Learning elementary structures for 3D shape generation and matching,73
2019,Learning Disentangled Representation for Robust Person Re-identification,31
2019,On Testing for Biases in Peer Review,34
2019,Learning Deterministic Weighted Automata with Queries and Counterexamples,22
2019,Making the Cut: A Bandit-based Approach to Tiered Interviewing,6
2019,Manifold-regression to predict from MEG/EEG brain signals without source modeling,18
2019,Sim2real transfer learning for 3D human pose estimation: motion to the rescue,65
2019,Unsupervised Curricula for Visual Meta-Reinforcement Learning,35
2019,Recurrent Kernel Networks,10
2019,A Universally Optimal Multistage Accelerated Stochastic Gradient Method,30
2019,Offline Contextual Bandits with High Probability Fairness Guarantees,14
2019,Bias Correction of Learned Generative Models using Likelihood-Free Importance Weighting,52
2019,LCA: Loss Change Allocation for Neural Network Training,26
2019,Polynomial Cost of Adaptation for X-Armed Bandits,6
2019,Modelling heterogeneous distributions with an Uncountable Mixture of Asymmetric Laplacians,9
2019,GNNExplainer: Generating Explanations for Graph Neural Networks,205
2019,Unsupervised learning of object structure and dynamics from videos,61
2019,Scalable Structure Learning of Continuous-Time Bayesian Networks from Incomplete Data,4
2019,Defense Against Adversarial Attacks Using Feature Scattering-based Adversarial Training,94
2019,Identifying Causal Effects via Context-specific Independence Relations,14
2019,Ordered Memory,11
2019,Approximating the Permanent by Sampling from Adaptive Partitions,5
2019,Reverse engineering recurrent networks for sentiment classification reveals line attractor dynamics,36
2019,Initialization of ReLUs for Dynamical Isometry,13
2019,On the Transfer of Inductive Bias from Simulation to the Real World: a New Disentanglement Dataset,43
2019,PowerSGD: Practical Low-Rank Gradient Compression for Distributed Optimization,80
2019,"Distribution oblivious, risk-aware algorithms for multi-armed   bandits with unbounded rewards",20
2019,G2SAT: Learning to Generate SAT Formulas,16
2019,The Functional Neural Process,35
2019,Multi-source Domain Adaptation for Semantic Segmentation,64
2019,On Exact Computation with an Infinitely Wide Neural Net,383
2019,Conditional Independence Testing using Generative Adversarial Networks,11
2019,Classification-by-Components: Probabilistic Modeling of Reasoning over a Set of Components,13
2019,User-Specified Local Differential Privacy in Unconstrained Adaptive Online Learning,14
2019,Learning Representations by Maximizing Mutual Information Across Views,527
2019,A neurally plausible model learns successor representations in partially observable environments,13
2019,Inherent Weight Normalization in Stochastic Neural Networks,3
2019,Structure Learning with Side Information: Sample Complexity,3
2019,Discrete Flows: Invertible Generative Models of Discrete Data,58
2019,Online-Within-Online Meta-Learning,22
2019,Using Statistics to Automate Stochastic Optimization,8
2019,D-VAE: A Variational Autoencoder for Directed Acyclic Graphs,59
2019,"Adversarial Examples Are Not Bugs, They Are Features",753
2019,Generalization in Reinforcement Learning with Selective Noise Injection and Information Bottleneck,51
2019,Certifiable Robustness to Graph Perturbations,51
2019,Rates of Convergence for Large-scale Nearest Neighbor Classification,9
2019,Self-Routing Capsule Networks,33
2019,A Model-Based Reinforcement Learning with Adversarial Training for Online Recommendation,32
2019,Multimodal Model-Agnostic Meta-Learning via Task-Aware Modulation,86
2019,On the Curved Geometry of Accelerated Optimization,18
2019,How to Initialize your Network? Robust Initialization for WeightNorm & ResNets,15
2019,Gradient based sample selection for online continual learning,129
2019,Selecting causal brain features with a single conditional independence test per feature,7
2019,Weakly Supervised Instance Segmentation using the Bounding Box Tightness Prior,45
2019,Copula-like Variational Inference,1
2019,Towards Hardware-Aware Tractable Learning of Probabilistic Models,10
2019,Two Time-scale Off-Policy TD Learning: Non-asymptotic Analysis over Markovian Samples,45
2019,Incremental Few-Shot Learning with Attention Attractor Networks,85
2019,Weight Agnostic Neural Networks,159
2019,DeepWave: A Recurrent Neural-Network for Real-Time Acoustic Imaging,3
2019,A Linearly Convergent Proximal Gradient Algorithm for Decentralized  Optimization,42
2019,Graph Structured Prediction Energy Networks,5
2019,Universal Invariant and Equivariant Graph Neural Networks,95
2019,Transfusion: Understanding Transfer Learning for Medical Imaging,413
