year,paper,citations
2018,Porcupine Neural Networks: Approximating Neural Network Landscapes,37
2018,Learning Disentangled Joint Continuous and Discrete Representations,129
2018,Attacks Meet Interpretability: Attribute-steered Detection of Adversarial Samples,102
2018,Learning To Learn Around A Common Mean,40
2018,Recurrent Relational Networks,98
2018,Reinforcement Learning with Multiple Experts: A Bayesian Model Combination Approach,17
2018,Differentiable MPC for End-to-end Planning and Control,148
2018,"Loss Surfaces, Mode Connectivity, and Fast Ensembling of DNNs",234
2018,Fairness Behind a Veil of Ignorance: A Welfare Analysis for Automated Decision Making,65
2018,A Unified View of Piecewise Linear Neural Network Verification,208
2018,Wavelet regression and additive models for irregularly spaced data,2
2018,Self-Erasing Network for Integral Object Attention,122
2018,Training deep learning based denoisers without ground truth data,63
2018,Realistic Evaluation of Deep Semi-Supervised Learning Algorithms,587
2018,Long short-term memory and Learning-to-learn in networks of spiking neurons,221
2018,Out of the Box: Reasoning with Graph Convolution Nets for Factual Visual Question Answering,109
2018,Distributed Multi-Player Bandits - a Game of Thrones Approach,83
2018,Blockwise Parallel Decoding for Deep Autoregressive Models,32
2018,Cooperative Learning of Audio and Video Models from Self-Supervised Synchronization,198
2018,FD-GAN: Pose-guided Feature Distilling GAN for Robust Person Re-identification,196
2018,Graphical Generative Adversarial Networks,23
2018,Explanations based on the Missing: Towards Contrastive Explanations with Pertinent Negatives,234
2018,M-Walk: Learning to Walk over Graphs using Monte Carlo Tree Search,63
2018,Unsupervised Image-to-Image Translation Using Domain-Specific Variational Information Bound,32
2018,Group Equivariant Capsule Networks,78
2018,Searching for Efficient Multi-Scale Architectures for Dense Image Prediction,277
2018,Adversarial Scene Editing: Automatic Object Removal from Weak Supervision,48
2018,Variational Inverse Control with Events: A General Framework for Data-Driven Reward Definition,55
2018,MULAN: A Blind and Off-Grid Method for Multichannel Echo Retrieval,7
2018,Breaking the Activation Function Bottleneck through Adaptive Parameterization,9
2018,Topkapi: Parallel and Fast Sketches for Finding Top-K Frequent Elements,8
2018,The Price of Fair PCA: One Extra dimension,71
2018,Orthogonally Decoupled Variational Gaussian Processes,31
2018,Algorithmic Assurance: An Active Approach to Algorithmic Testing using Bayesian Optimisation,10
2018,High Dimensional Linear Regression using Lattice Basis Reduction,8
2018,Efficient inference for time-varying behavior during learning,17
2018,Re-evaluating evaluation,69
2018,Learning Abstract Options,47
2018,PG-TS: Improved Thompson Sampling for Logistic Contextual Bandits,21
2018,Variance-Reduced Stochastic Gradient Descent on Streaming Data,15
2018,GradiVeQ: Vector Quantization for Bandwidth-Efficient Gradient Aggregation in Distributed CNN Training,41
2018,Theoretical Linear Convergence of Unfolded ISTA and Its Practical Weights and Thresholds,114
2018,Neural Edit Operations for Biological Sequences,6
2018,Temporal alignment and latent Gaussian process factor inference in population spike trains,34
2018,Dimensionality Reduction for Stationary Time Series via Stochastic Nonconvex Optimization,5
2018,"Nonlocal Neural Networks, Nonlocal Diffusion and Nonlocal Modeling",26
2018,SLANG: Fast Structured Covariance Approximations for Bayesian Deep Learning with Natural Gradient,35
2018,Preference Based Adaptation for Learning Objectives,1
2018,Learning Invariances using the Marginal Likelihood,30
2018,NEON2: Finding Local Minima via First-Order Oracles,98
2018,Lipschitz regularity of deep neural networks: analysis and efficient estimation,159
2018,Graph Convolutional Policy Network for Goal-Directed Molecular Graph Generation,432
2018,Dialog-to-Action: Conversational Question Answering Over a Large-Scale Knowledge Base,65
2018,Text-Adaptive Generative Adversarial Networks: Manipulating Images with Natural Language,79
2018,Exploration in Structured Reinforcement Learning,37
2018,Tree-to-tree Neural Networks for Program Translation,133
2018,Virtual Class Enhanced Discriminative Embedding Learning,32
2018,How to Start Training: The Effect of Initialization and Architecture,133
2018,Video-to-Video Synthesis,594
2018,Occam's razor is insufficient to infer the preferences of irrational agents,59
2018,Adversarial Regularizers in Inverse Problems,118
2018,The emergence of multiple retinal cell types through efficient coding of natural movies,18
2018,Approximating Real-Time Recurrent Learning with Random Kronecker Factors,33
2018,Hyperbolic Neural Networks,171
2018,Mean Field for the Stochastic Blockmodel: Optimization Landscape and Convergence Issues,11
2018,Fast Greedy MAP Inference for Determinantal Point Process to Improve Recommendation Diversity,78
2018,Gather-Excite: Exploiting Feature Context in Convolutional Neural Networks,215
2018,DeepProbLog:  Neural Probabilistic Logic Programming,233
2018,Image-to-image translation for cross-domain disentanglement,149
2018,TopRank: A practical algorithm for online stochastic ranking,39
2018,Minimax Estimation of Neural Net Distance,7
2018,Using Large Ensembles of Control Variates for Variational Inference,12
2018,Practical Methods for Graph Two-Sample Testing,25
2018,Learning to Navigate in Cities Without a Map,193
2018,Fast greedy algorithms for dictionary selection with generalized sparsity constraints,2
2018,Invertibility of Convolutional Generative Networks from Partial Measurements,54
2018,Towards Robust Detection of Adversarial Examples,127
2018,Sparse Attentive Backtracking: Temporal Credit Assignment Through Reminding,72
2018,Dynamic Network Model from Partial Observations,11
2018,Actor-Critic Policy Optimization in Partially Observable Multiagent Environments,92
2018,Relational recurrent neural networks,155
2018,Kalman Normalization: Normalizing Internal Representations Across Network Layers,21
2018,Are GANs Created Equal? A Large-Scale Study,694
2018,Recurrent Transformer Networks for Semantic Correspondence,64
2018,FRAGE: Frequency-Agnostic Word Representation,101
2018,Joint Active Feature Acquisition and Classification with Variable-Size Set Encoding,34
2018,Data-Efficient Hierarchical Reinforcement Learning,373
2018,Verifiable Reinforcement Learning via Policy Extraction,135
2018,A Simple Proximal Stochastic Gradient Method for Nonsmooth Nonconvex Optimization,57
2018,Hierarchical Graph Representation Learning with Differentiable Pooling,548
2018,Efficient Loss-Based Decoding on Graphs for Extreme Classification,5
2018,Scalable methods for 8-bit training of neural networks,153
2018,Solving Large Sequential Games with the Excessive Gap Technique,28
2018,Step Size Matters in Deep Learning,18
2018,Convex Elicitation of Continuous Properties,1
2018,Bandit Learning with Positive Externalities,13
2018,Learning long-range spatial dependencies with horizontal gated recurrent units,61
2018,(Probably) Concave Graph Matching,6
2018,HOUDINI: Lifelong Learning as Program Synthesis,40
2018,Snap ML: A Hierarchical Framework for Machine Learning,21
2018,Embedding Logical Queries on Knowledge Graphs,126
2018,Learning Versatile Filters for Efficient Convolutional Neural Networks,31
2018,Neural Nearest Neighbors Networks,186
2018,Learning latent variable structured prediction models with Gaussian perturbations,4
2018,Differentially Private Change-Point Detection,23
2018,Proximal Graphical Event Models,24
2018,Low-rank Interaction with Sparse Additive Effects Model for Large Data Frames,6
2018,Generalized Cross Entropy Loss for Training Deep Neural Networks with Noisy Labels,743
2018,Inference Aided Reinforcement Learning for Incentive Mechanism Design in Crowdsourcing,13
2018,Online Structured Laplace Approximations for Overcoming Catastrophic Forgetting,133
2018,Neural Architecture Search with Bayesian Optimisation and Optimal Transport,341
2018,BinGAN: Learning Compact Binary Descriptors with a Regularized GAN,37
2018,Communication Efficient Parallel Algorithms for Optimization on Manifolds,5
2018,Why so gloomy? A Bayesian explanation of human pessimism bias in the multi-armed bandit task,5
2018,Robust Subspace Approximation in a Stream,4
2018,Learning convex bounds for linear quadratic control policy synthesis,8
2018,Mean-field theory of graph neural networks in graph partitioning,32
2018,Assessing Generative Models via Precision and Recall,196
2018,Improved Network Robustness with Adversary Critic,6
2018,A Practical Algorithm for Distributed Clustering and Outlier Detection,14
2018,Loss Functions for Multiset Prediction,12
2018,SEGA: Variance Reduction via Gradient Sketching,37
2018,Flexible neural representation for physics prediction,121
2018,A Stein variational Newton method,72
2018,LAG: Lazily Aggregated Gradient for Communication-Efficient Distributed Learning,157
2019,XNAS: Neural Architecture Search with Expert Advice,90
2019,Multi-resolution Multi-task Gaussian Processes,21
2019,Deep Equilibrium Models,150
2019,Cross Attention Network for Few-shot Classification,169
2019,Asymmetric Valleys: Beyond Sharp and Flat Local Minima,45
2019,Improved Precision and Recall Metric for Assessing Generative Models,118
2019,Hyperspherical Prototype Networks,35
2019,Generalization of Reinforcement Learners with Working and Episodic Memory,20
2019,DTWNet: a Dynamic Time Warping Network,20
2019,Explicit Explore-Exploit Algorithms in Continuous State Spaces,13
2019,Hyperbolic Graph Convolutional Neural Networks,168
2019,SpArSe: Sparse Architecture Search for CNNs on Resource-Constrained Microcontrollers,56
2019,Information-Theoretic Generalization Bounds for SGLD via Data-Dependent Estimates,51
2019,Robust exploration in linear quadratic reinforcement learning,18
2019,Modeling Uncertainty by Learning a Hierarchy of Deep Neural Connections,10
2019,Meta-Surrogate Benchmarking for Hyperparameter Optimization,25
2019,State Aggregation Learning from Markov Transition Data,24
2019,Reliable training and estimation of variance networks,25
2019,Meta-Learning with Implicit Gradients,266
2019,Differentially Private Markov Chain Monte Carlo,10
2019,Universal Boosting Variational Inference,17
2019,The Geometry of Deep Networks: Power Diagram Subdivision,172019,Equal Opportunity in Online Classification with Partial Feedback,30
2019,Interior-Point Methods Strike Back: Solving the Wasserstein Barycenter Problem,14
2019,GPipe: Efficient Training of Giant Neural Networks using Pipeline Parallelism,559
2019,DiskANN: Fast Accurate Billion-point Nearest Neighbor Search on a Single Node,15
2019,Linear Stochastic Bandits Under Safety Constraints,28
2019,Variational Mixture-of-Experts Autoencoders for Multi-Modal Deep Generative Models,63
2019,Language as an Abstraction for Hierarchical Deep Reinforcement Learning,62
2019,High-dimensional multivariate forecasting with low-rank Gaussian Copula Processes,37
2019,Learning Macroscopic Brain Connectomes via Group-Sparse Factorization,2
2019,DRUM: End-To-End Differentiable Rule Mining On Knowledge Graphs,49
2019,Retrosynthesis Prediction with Conditional Graph Logic Network,41
2019,Unsupervised Emergence of Egocentric Spatial Structure from Sensorimotor Prediction,4
2019,Adversarial Robustness through Local Linearization,131
2019,Generalized Off-Policy Actor-Critic,30
2019,"Average Individual Fairness: Algorithms, Generalization and Experiments",33
2019,Approximate Bayesian Inference for a Mechanistic Model of Vesicle Release at a Ribbon Synapse,8
2019,Data-dependent Sample Complexity of Deep Neural Networks via Lipschitz Augmentation,42
2019,Semi-supervisedly Co-embedding Attributed Networks,13
2019,Training Image Estimators without Image Ground Truth,5
2019,The Label Complexity of Active Learning from Observational Data,8
2019,Learning Fairness in Multi-Agent Systems,14
2019,Discovery of Useful Questions as Auxiliary Tasks,37
2019,"Deconstructing Lottery Tickets: Zeros, Signs, and the Supermask",148
2019,Fast and Flexible Multi-Task Classification using Conditional Neural Adaptive Processes,72
2019,A Simple Baseline for Bayesian Uncertainty in Deep Learning,245
2019,Low-Complexity Nonparametric Bayesian Online Prediction with Universal Guarantees,0
2019,Finding the Needle in the Haystack with Convolutions: on the benefits of architectural bias,11
2019,Learning Local Search Heuristics for Boolean Satisfiability,41
2019,Learning to Perform Local Rewriting for Combinatorial Optimization,82
2019,A Unified Bellman Optimality Principle Combining Reward Maximization and Empowerment,21
2019,Probabilistic Logic Neural Networks for Reasoning,53
2019,Joint-task Self-supervised Learning for Temporal Correspondence,50
2019,Dying Experts: Efficient Algorithms with Optimal Regret Bounds,3
2019,A Bayesian Theory of Conformity in Collective Decision Making,4
2019,Sequence Modeling with Unconstrained Generation Order,10
2019,Visualizing and Measuring the Geometry of BERT,187
2019,Copulas as High-Dimensional Generative Models: Vine Copula Autoencoders,10
2019,q-means: A quantum algorithm for unsupervised machine learning,64
2019,RUDDER: Return Decomposition for Delayed Rewards,93
2019,Convergence Guarantees for Adaptive Bayesian Quadrature Methods,16
2019,A First-Order Algorithmic Framework for Distributionally Robust Logistic Regression,6
2019,Semantic-Guided Multi-Attention Localization for Zero-Shot Learning,54
2019,Distributionally Robust Optimization and Generalization in Kernel Methods,37
2019,Metalearned Neural Memory,30
2019,Large Scale Adversarial Representation Learning,264
2019,Hindsight Credit Assignment,26
2019,Zero-shot Learning via Simultaneous Generating and Learning,30
2019,Trivializations for Gradient-Based Optimization on Manifolds,44
2019,On the Fairness of Disentangled Representations,95
2019,Correlation Priors for Reinforcement Learning,4
2019,Accurate Uncertainty Estimation and Decomposition in Ensemble Learning,21
2019,Globally Optimal Learning for Structured Elliptical Losses,1
2019,MixMatch: A Holistic Approach to Semi-Supervised Learning,905
2019,Preventing Gradient Attenuation in Lipschitz Constrained Convolutional Networks,30
2019,Attentive State-Space Modeling of Disease Progression,38
2019,ADDIS: an adaptive discarding algorithm for online FDR control with conservative nulls,14
2019,Exploring Algorithmic Fairness in Robust Graph Covering Problems,19
2019,Neural networks grown and self-organized by noise,1
2019,HyperGCN: A New Method For Training Graph Convolutional Networks on Hypergraphs,103
2019,Asymptotics for Sketching in Least Squares Regression,30
2019,Chirality Nets for Human Pose Regression,13
2019,TAB-VCR: Tags and Attributes based VCR Baselines,10
2019,Multiclass Performance Metric Elicitation,7
2019,Assessing Social and Intersectional Biases in Contextualized Word Representations,55
2019,MaCow: Masked Convolutional Generative Flow,32
2019,High-Quality Self-Supervised Deep Image Denoising,114
2019,Augmented Neural ODEs,224
2019,Regularizing Trajectory Optimization with Denoising Autoencoders,5
2019,Multi-Criteria Dimensionality Reduction with Applications to Fairness,16
2019,Turbo Autoencoder: Deep learning based channel codes for point-to-point communication channels,45
2019,Diffusion Improves Graph Learning,119
2019,A Convex Relaxation Barrier to Tight Robustness Verification of Neural Networks,112
2019,A Latent Variational Framework for Stochastic Optimization,2
2019,"Painless Stochastic Gradient: Interpolation, Line-Search, and Convergence Rates",89
2019,Tight Regret Bounds for Model-Based Reinforcement Learning with Greedy Policies,42
2019,Weighted Linear Bandits for Non-Stationary Environments,50
2019,Neural Lyapunov Control,71
2019,Stochastic Variance Reduced Primal Dual Algorithms for Empirical Composition Optimization,6
2019,Hamiltonian Neural Networks,279
2019,Differentiable Cloth Simulation for Inverse Problems,43
2019,Detecting Overfitting via Adversarial Examples,25
2019,Region-specific Diffeomorphic Metric Mapping,20
2019,Domain Generalization via Model-Agnostic Learning of Semantic Features,192
2019,Unconstrained Monotonic Neural Networks,55
2019,Efficient Identification in Linear Structural Causal Models with Instrumental Cutsets,5
2019,Learning Non-Convergent Non-Persistent Short-Run MCMC Toward Energy-Based Model,89
2019,Interval timing in deep reinforcement learning agents,7
2019,Uncertainty-based Continual Learning with Adaptive Regularization,44
2019,Subspace Attack: Exploiting Promising Subspaces for Query-Efficient Black-box Attacks,39
2019,Combinatorial Bayesian Optimization using the Graph Cartesian Product,44
2019,Stacked Capsule Autoencoders,140
2019,"N-Gram Graph: Simple Unsupervised Representation for Graphs, with Applications to Molecules",41
2019,The spiked matrix model with generative priors,31
2019,A coupled autoencoder approach for multi-modal analysis of cell types,14
2019,Meta-Inverse Reinforcement Learning with Probabilistic Context Variables,22
2019,Exact inference in structured prediction,2
2019,Practical and Consistent Estimation of f-Divergences,19
2019,R2D2: Reliable and Repeatable Detector and Descriptor,43
2019,First Order Motion Model for Image Animation,170
2019,Scalable inference of topic evolution via models for latent geometric structures,7
2019,Anti-efficient encoding in emergent communication,40
2019,PointDAN: A Multi-Scale 3D Domain Adaption Network for Point Cloud Representation,53
2019,Stand-Alone Self-Attention in Vision Models,349
2019,Explicit Disentanglement of Appearance and Perspective in Generative Models,17
2019,Poisson-Minibatching for Gibbs Sampling with Convergence Rate Guarantees,7
2019,On Mixup Training: Improved Calibration and Predictive Uncertainty for Deep Neural Networks,149
2019,Symmetry-Based Disentangled Representation Learning requires Interaction with Environments,27
2019,Mining GOLD Samples for Conditional GANs,3
2019,Few-shot Video-to-Video Synthesis,137
2019,Unlocking Fairness: a Trade-off Revisited,39
2019,Evaluating Protein Transfer Learning with TAPE,180
2019,Recurrent Space-time Graph Neural Networks,18
2019,Singleshot : a scalable Tucker tensor decomposition,2
2019,DISN: Deep Implicit Surface Network for High-quality Single-view 3D Reconstruction,173
2019,Personalizing Many Decisions with High-Dimensional Covariates,3
2019,Fully Neural Network based Model for General Temporal Point Processes,46
2019,Improving Textual Network Learning with Variational Homophilic Embeddings,11
2019,"Think Globally, Act Locally: A Deep Neural Network Approach to High-Dimensional Time Series Forecasting",94
2019,Handling correlated and repeated measurements with the smoothed multivariate square-root Lasso,9
2019,Efficient Neural Architecture Transformation Search in Channel-Level for Object Detection,32
2019,CXPlain: Causal Explanations for Model Interpretation under Uncertainty,60
2019,Principal Component Projection and Regression in Nearly Linear Time through Asymmetric SVRG,2
2019,A Structured Prediction Approach for Generalization in Cooperative Multi-Agent Reinforcement Learning,13
2019,On Fenchel Mini-Max Learning,13
2019,Stability of Graph Scattering Transforms,37
2019,More Is Less: Learning Efficient Video Representations by Big-Little Network and Depthwise Temporal Aggregation,42
2019,Revisiting the Bethe-Hessian: Improved Community Detection in Sparse Heterogeneous Graphs,13
2019,Defending Against Neural Fake News,338
2019,Robust and Communication-Efficient Collaborative Learning,51
2019,Learning Robust Global Representations by Penalizing Local Predictive Power,80
2019,Average-Case Averages: Private Algorithms for Smooth Sensitivity and Mean Estimation,29
2019,Faster Boosting with Smaller Memory,5
2019,Modelling the Dynamics of Multiagent Q-Learning in Repeated Symmetric Games: a Mean Field Theoretic Approach,2
2019,Bootstrapping Upper Confidence Bound,18
2019,DETOX: A Redundancy-based Framework for Faster and More Robust Gradient Aggregation,47
2019,Meta-Reinforced Synthetic Data for One-Shot Fine-Grained Visual Recognition,18
2019,Learning-In-The-Loop Optimization: End-To-End Control And Co-Design Of Soft Robots Through Learned Deep Latent Representations,21
2019,Invariance and identifiability issues for word embeddings,1
2019,PC-Fairness: A Unified Framework for Measuring Causality-based Fairness,34
2019,Worst-Case Regret Bounds for Exploration via Randomized Value Functions,38
2019,Glyce: Glyph-vectors for Chinese Character Representations,69
2019,Fast and Provable ADMM for Learning with Generative Priors,24
2019,GRU-ODE-Bayes: Continuous Modeling of Sporadically-Observed Time Series,81
2019,General E(2)-Equivariant Steerable CNNs,90
2019,Learning nonlinear level sets for dimensionality reduction in function approximation,20
2019,Explaining Landscape Connectivity of Low-cost Solutions for Multilayer Nets,37
2019,Limitations of the empirical Fisher approximation for natural gradient descent,69
2019,"Fast, Provably convergent IRLS Algorithm for p-norm Linear Regression",14
2019,Empirically Measuring Concentration: Fundamental Limits on Intrinsic Robustness,11
2019,Drill-down: Interactive Retrieval of Complex Scenes using Natural Language Queries,9
2019,Graph Agreement Models for Semi-Supervised Learning,31
2019,Generalization in Generative Adversarial Networks: A Novel Perspective from Privacy Protection,26
2019,Model Similarity Mitigates Test Set Overuse,19
2019,Explicit Planning for Efficient Exploration in Reinforcement Learning,4
2019,vGraph: A Generative Model for Joint Community Detection and Node Representation Learning,35
2019,Can Unconditional Language Models Recover Arbitrary Sentences?,12
2019,A Kernel Loss for Solving the Bellman Equation,32
2019,Covariate-Powered Empirical Bayes Estimation,11
2019,AGEM: Solving Linear Inverse Problems via Deep Priors and Sampling,6
2019,Devign: Effective Vulnerability Identification by Learning Comprehensive Program Semantics via Graph Neural Networks,90
2019,Learning Robust Options by Conditional Value at Risk Optimization,8
2019,Towards modular and programmable architecture search,11
2019,A Prior of a Googol Gaussians: a Tensor Ring Induced Prior for Generative Models,11
2019,Beating SGD Saturation with Tail-Averaging  and Minibatching,18
2019,Extending Stein's unbiased risk estimator to train deep denoisers with correlated pairs of noisy images,19
2019,Understanding the Role of Momentum in Stochastic Gradient Methods,38
2019,DAC: The Double Actor-Critic Architecture for Learning Options,19
2019,Safe Exploration for Interactive Machine Learning,30
2019,Neuropathic Pain Diagnosis Simulator for Causal Discovery Algorithm Evaluation,8
2019,Parameter elimination in particle Gibbs sampling,4
2019,Understanding Sparse JL for Feature Hashing,11
2019,Dynamic Local Regret for Non-convex Online Forecasting,3
2019,"Write, Execute, Assess: Program Synthesis with a REPL",54
2019,Conformalized Quantile Regression,92
2019,High-Dimensional Optimization in Adaptive Random Subspaces,12
2019,Cold Case: The Lost MNIST Digits,53
2019,RUBi: Reducing Unimodal Biases for Visual Question Answering,114
2019,Text-Based Interactive Recommendation via Constraint-Augmented Reinforcement Learning,35
2019,Learning to Correlate in Multi-Player General-Sum Sequential Games,21
2019,Learning Sample-Specific Models with Low-Rank Personalized Regression,8
2019,Learning Reward Machines for Partially Observable Reinforcement Learning,31
2019,Addressing Sample Complexity in Visual Tasks Using HER and Hallucinatory GANs,13
2019,Unsupervised Scalable Representation Learning for Multivariate Time Series,81
2019,Bayesian Learning of Sum-Product Networks,22
2019,Policy Optimization Provably Converges to Nash Equilibria in Zero-Sum Linear Quadratic Games,66
2019,Real-Time Reinforcement Learning,17
2019,Discriminative Topic Modeling with Logistic LDA,11
2019,Streaming Bayesian Inference for Crowdsourced Classification,2
2019,Disentangling Influence: Using disentangled representations to audit model predictions,11
2019,Demystifying Black-box Models with Symbolic Metamodels,29
2019,U-Time: A Fully Convolutional Network for Time Series Segmentation Applied to Sleep Staging,46
2019,Meta-Curvature,55
2019,Exploration via Hindsight Goal Generation,26
2019,Reducing Noise in GAN Training with Variance Reduced Extragradient,78
2019,Knowledge Extraction with No Observable Data,32
2019,Neural Jump Stochastic Differential Equations,87
2019,Learning about an exponential amount of conditional distributions,19
2019,Statistical bounds for entropic optimal transport: sample complexity and the central limit theorem,59
2019,Scalable Bayesian dynamic covariance modeling with variational Wishart and inverse Wishart processes,6
2019,Variational Bayesian Decision-making for Continuous Utilities,11
2019,Optimal Sparsity-Sensitive Bounds for  Distributed Mean Estimation,4
2019,Search on the Replay Buffer: Bridging Planning and Reinforcement Learning,99
2019,Transductive Zero-Shot Learning with Visual Structure Constraint,38
2019,Certainty Equivalence is Efficient for Linear Quadratic Control,107
2019,Stein Variational Gradient Descent With Matrix-Valued Kernels,24
2019,Universality and individuality in neural dynamics across large populations of recurrent networks,53
2019,When to Trust Your Model: Model-Based Policy Optimization,258
2019,Blind Super-Resolution Kernel Estimation using an Internal-GAN,114
